{"pageProps":{"postMetadata":{"title":"Super fast Python (Part-5): Numba","description":"Speed up Numerical computations and functions in Python with Numba and Numpy.","imgName":"super-fast-python-numba/super-fast-python-numba.jpg","date":"Dec 25, 2022","tags":["python-performance","python"],"keywords":["numba","python-performance","python-optimize","python","fast-python","speed","jit","numba-numpy"],"id":"super-fast-python-numba"},"postContent":{"compiledSource":"var c=Object.defineProperty,u=Object.defineProperties;var h=Object.getOwnPropertyDescriptors;var i=Object.getOwnPropertySymbols;var r=Object.prototype.hasOwnProperty,s=Object.prototype.propertyIsEnumerable;var p=(t,a,n)=>a in t?c(t,a,{enumerable:!0,configurable:!0,writable:!0,value:n}):t[a]=n,e=(t,a)=>{for(var n in a||(a={}))r.call(a,n)&&p(t,n,a[n]);if(i)for(var n of i(a))s.call(a,n)&&p(t,n,a[n]);return t},l=(t,a)=>u(t,h(a));var m=(t,a)=>{var n={};for(var o in t)r.call(t,o)&&a.indexOf(o)<0&&(n[o]=t[o]);if(t!=null&&i)for(var o of i(t))a.indexOf(o)<0&&s.call(t,o)&&(n[o]=t[o]);return n};const layoutProps={},MDXLayout=\"wrapper\";function MDXContent(n){var o=n,{components:t}=o,a=m(o,[\"components\"]);return mdx(MDXLayout,l(e(e({},layoutProps),a),{components:t,mdxType:\"MDXLayout\"}),mdx(\"p\",null,mdx(\"img\",e({parentName:\"p\"},{src:\"super-fast-python-numba/super-fast-python-numba.jpg\",alt:\"Super fast Python: Numba\"}))),mdx(\"h6\",null,\"Published on: \",mdx(\"strong\",{parentName:\"h6\"},\"Dec 25, 2022\")),mdx(\"h1\",null,\"Super fast Python (Part-5): Numba\"),mdx(\"p\",null,\"This is the fifth and last post in the series on Python performance and Optimization. The series points out the utilization of inbuilt libraries, low-level code conversions, and other Python implementations to speed-up Python. The other posts included in this series are\"),mdx(\"ul\",null,mdx(\"li\",{parentName:\"ul\"},\"(Part-1): \",mdx(\"a\",e({parentName:\"li\"},{href:\"https://santhalakshminarayana.github.io/blog/super-fast-python-why-python-slow\"}),\"Why Python is slow?\")),mdx(\"li\",{parentName:\"ul\"},\"(Part-2): \",mdx(\"a\",e({parentName:\"li\"},{href:\"https://santhalakshminarayana.github.io/blog/super-fast-python-good-practices\"}),\"Good practices to write fast Python code\")),mdx(\"li\",{parentName:\"ul\"},\"(Part-3): \",mdx(\"a\",e({parentName:\"li\"},{href:\"https://santhalakshminarayana.github.io/blog/super-fast-python-multi-processing\"}),\"Multi-processing in Python\")),mdx(\"li\",{parentName:\"ul\"},\"(Part-4): \",mdx(\"a\",e({parentName:\"li\"},{href:\"https://santhalakshminarayana.github.io/blog/super-fast-python-cython\"}),\"Use Cython to get speed as fast as C\")),mdx(\"li\",{parentName:\"ul\"},\"(Part-5): Use Numba to speed up Python Functions (this post)\")),mdx(\"p\",null,\"In the last post about \",mdx(\"a\",e({parentName:\"p\"},{href:\"https://santhalakshminarayana.github.io/blog/super-fast-python-cython\"}),\"Cython to speed-up Python code\"),\", we discussed writing Python code in C-style, compiling that code separately into an object file, and using that generated file as an import directly into Python. But, not all people would feel comfortable writing C-style code or even some might not know C at all. So, to deal with such cases and get the performant efficient code to speed-up Python, one can use \",mdx(\"a\",e({parentName:\"p\"},{href:\"https://numba.pydata.org/\"}),\"Numba\"),\" instead. Numba translates Python code to machine code that executes almost as fast as C/C++ if optimized correctly.\"),mdx(\"h2\",null,\"What is Numba?\"),mdx(\"p\",null,\"Numba is a JIT (just-in-time) compiler that takes Python byte code and compiles it into machine code directly using \",mdx(\"a\",e({parentName:\"p\"},{href:\"https://llvm.org/\"}),\"LLVM\"),\" compiling mechanism. JIT is a type of interpreter that compiles frequently called code into machine code and caches that generated machine code to be used later for faster execution type. Here, Numba also takes Python code and generated machine code which the Python interpreter calls directly instead of interpreting and converting to machine code each time. Numba works best for numerical calculations, Array and Numpy operations, and loops. With Numba, we can write vectorized operations and parallelized loops to run on either CPU or GPU.\"),mdx(\"p\",null,\"Numba decorators are one of the many ways to invoke the JIT compilation. Numba provides different decorators to compile code in different modes and types, the common decorators used in Numba are:\"),mdx(\"ul\",null,mdx(\"li\",{parentName:\"ul\"},\"@jit - invoke JIT compilation for the provided function\"),mdx(\"li\",{parentName:\"ul\"},\"@njit - @jit decorator with enabling strict no-python mode\"),mdx(\"li\",{parentName:\"ul\"},\"@vectorize - convert normal functions into Numpy like \",mdx(\"strong\",{parentName:\"li\"},\"ufuncs\")),mdx(\"li\",{parentName:\"ul\"},\"@guvectorize - generalized \",mdx(\"strong\",{parentName:\"li\"},\"ufuncs\"),\" for higher dimensional arrays\"),mdx(\"li\",{parentName:\"ul\"},\"@stencil - make a function behave as a kernel for a \",mdx(\"strong\",{parentName:\"li\"},\"stencil\"),\" like operation\")),mdx(\"p\",null,\"Numba also provides different options to pass for some of these decorators to configure the JIT compilation behavior\"),mdx(\"ul\",null,mdx(\"li\",{parentName:\"ul\"},\"nopython\"),mdx(\"li\",{parentName:\"ul\"},\"parallel\"),mdx(\"li\",{parentName:\"ul\"},\"cache\"),mdx(\"li\",{parentName:\"ul\"},\"nogil\"),mdx(\"li\",{parentName:\"ul\"},\"fastmath\"),mdx(\"li\",{parentName:\"ul\"},\"boundscheck\"),mdx(\"li\",{parentName:\"ul\"},\"error_model\"),mdx(\"li\",{parentName:\"ul\"},\"cuda\")),mdx(\"h2\",null,\"Numba @jit\"),mdx(\"p\",null,mdx(\"strong\",{parentName:\"p\"},\"@jit\"),\" decorator takes the Python function that needs to machine code compiled. When we make a call to the function we provided to \",mdx(\"strong\",{parentName:\"p\"},\"@jit\"),\", upon the first time calling, Numba compiles the function, caches the machine code, and this machine code is directly used for the execution. As compilation takes time, the first-time call to the function gives some latency. But, for consecutive function calls in the same runtime, just the cached machine code is used instead of re-compiling every time.\"),mdx(\"p\",null,\"Let's consider the following simple function \",mdx(\"em\",{parentName:\"p\"},\"solve_expression\"),\" as an example. \",mdx(\"em\",{parentName:\"p\"},\"solve_expression\"),\" takes some arguments, checks some conditions, and calculates the final polynomial expression.\"),mdx(\"pre\",null,mdx(\"code\",e({parentName:\"pre\"},{className:\"language-python\"}),`def solve_expression(x, a, b, c, d):\n    A, B, C, D = a, b, c, d\n    if a > 10.1:\n        A = 2 * a\n    if 2.6 <= b < 8.3:\n        B = b - 1/b\n    if c > 4.5:\n        C = 4\n    if d < 9.0:\n        D = d ** 2\n\n    return A*(x**3) + B*(x**2) + C*(x) + D\n`)),mdx(\"p\",null,\"Now, use the \",mdx(\"strong\",{parentName:\"p\"},\"@jit\"),\" decorator to compile this function into machine code as\"),mdx(\"pre\",null,mdx(\"code\",e({parentName:\"pre\"},{className:\"language-python\"}),`from numba import jit\n\n@jit\ndef solve_expression(x, a, b, c, d):\n    A, B, C, D = a, b, c, d\n    if a > 10.1:\n        A = 2 * a\n    if 2.6 <= b < 8.3:\n        B = b - 1/b\n    if c > 4.5:\n        C = 4\n    if d < 9.0:\n        D = d ** 2\n\n    return A*(x**3) + B*(x**2) + C*(x) + D\n`)),mdx(\"p\",null,\"In the code snippet, we have imported the \",mdx(\"strong\",{parentName:\"p\"},\"jit\"),\" function decorator and decorated \",mdx(\"em\",{parentName:\"p\"},\"solve_expression\"),\" with it.\"),mdx(\"pre\",null,mdx(\"code\",e({parentName:\"pre\"},{className:\"language-python\"}),`x, a, b, c, d = 2, 13, 1.2, 4, 7\n\nres = solve_expression(x, a, b, c, d)\n`)),mdx(\"blockquote\",null,mdx(\"p\",{parentName:\"blockquote\"},\"Inspect the Intermediate Representation (IR) of the function using solve_expression.inspect_types()\")),mdx(\"p\",null,\"As Numba \",mdx(\"strong\",{parentName:\"p\"},\"@jit\"),\" defers the JIT compilation until it encounters the first call to the function, the function call with arguments \",mdx(\"em\",{parentName:\"p\"},\"solve_expression(x, a, b, c, d)\"),\" takes some time for executions. But, function calls later at this point will be fast.\"),mdx(\"p\",null,\"Now compare the speeds of the normal Python function and Numba JIT decorated function. Using \",mdx(\"em\",{parentName:\"p\"},\"solve_expression.py_func()\"),\", we can invoke the normal python function of this JIT decorated function.\"),mdx(\"pre\",null,mdx(\"code\",e({parentName:\"pre\"},{className:\"language-python\"}),`%% timeit\nres = solve_expression.py_func(x, a, b, c, d)\n\n'''Output\n912 ns \\xB1 3.47 ns per loop (mean \\xB1 std. dev. of 7 runs, 1000000 loops each)\n'''\n`)),mdx(\"p\",null,\"The normal Python function takes approx. 900 nanoseconds.\"),mdx(\"pre\",null,mdx(\"code\",e({parentName:\"pre\"},{className:\"language-python\"}),`%%timeit\nres = solve_expression(x, a, b, c, d)\n\n'''Output\n277 ns \\xB1 1.36 ns per loop (mean \\xB1 std. dev. of 7 runs, 1000000 loops each)\n'''\n`)),mdx(\"p\",null,\"And the Numba version takes approx. 280 nanoseconds. The Numba version is 3x times faster than the pure Python function.\"),mdx(\"h3\",null,\"Compilation options\"),mdx(\"p\",null,\"For \",mdx(\"strong\",{parentName:\"p\"},\"@jit\"),\" decorator, we can pass multiple options to configure the compilation behavior\"),mdx(\"ul\",null,mdx(\"li\",{parentName:\"ul\"},mdx(\"strong\",{parentName:\"li\"},\"nopython\"),\": if True, enables no-python mode making code execution without Python interpreter interference\"),mdx(\"li\",{parentName:\"ul\"},mdx(\"strong\",{parentName:\"li\"},\"nogil\"),\": if True, releases the GIL (only when \",mdx(\"em\",{parentName:\"li\"},\"nopython=True\"),\") inside the compiled function, useful for concurrent execution such as threads\"),mdx(\"li\",{parentName:\"ul\"},mdx(\"strong\",{parentName:\"li\"},\"cache\"),\": if True, store the compiled code in local storage and use this code whenever the function is called instead of re-compiling for every runtime\"),mdx(\"li\",{parentName:\"ul\"},mdx(\"strong\",{parentName:\"li\"},\"parallel\"),\": if True, enables automatic parallelization\"),mdx(\"li\",{parentName:\"ul\"},mdx(\"strong\",{parentName:\"li\"},\"fastmath\"),\": if True, uses faster math operations but less safe floating-point operations\")),mdx(\"p\",null,\"Apart from these, there are some more options available. You can check all options at \",mdx(\"a\",e({parentName:\"p\"},{href:\"https://numba.readthedocs.io/en/stable/reference/jit-compilation.html#jit-functions\"}),\"@jit reference\"),\".\"),mdx(\"h2\",null,\"Lazy and Eager compilation\"),mdx(\"p\",null,\"Note that, as Python function arguments can take any time of arguments, Numba compiles the function for that specific type of the argument passed. If a new type of argument is passed to the function while calling, Numba re-compiles the code for that specific type.\"),mdx(\"h3\",null,\"Lazy compilation\"),mdx(\"p\",null,\"The above \",mdx(\"em\",{parentName:\"p\"},\"solve_expression()\"),\" function takes any type of argument. If we provide a function like this Numba calculates the optimization steps to be done based on the argument types provided at the first function call. In this way, Numba infers the argument types and compiles the specific version of the same function for different types.\"),mdx(\"p\",null,\"Ex: if we change the argument types like this\"),mdx(\"pre\",null,mdx(\"code\",e({parentName:\"pre\"},{className:\"language-python\"}),`# previous values, x, a, b, c, d = 2, 13, 1.2, 4, 7\n# new values\nx, a, b, c, d = 3.9, 12, 5, 9.1, 14\n\nres = solve_expression(x, a, b, c, d)\n`)),mdx(\"p\",null,\"As the previous compiled function expects types for \",mdx(\"em\",{parentName:\"p\"},\"x=int, a=int, b=float, c=int, d=int\"),\", and in the latest function call we have changed some argument types. So, Numba re-compiles the function for new argument types. This mode of the compilation of code is called lazy compilation because Numba compiles for specific argument types only if it encounters them.\"),mdx(\"h3\",null,\"Eager compilation\"),mdx(\"p\",null,\"For function overloading, we can specify function signatures with argument types and return types in a list with the least significant precision at the top. \",mdx(\"a\",e({parentName:\"p\"},{href:\"https://numba.readthedocs.io/en/stable/reference/types.html\"}),\"Numba types\"),\" follow Numpy convention types with different precision levels.\"),mdx(\"pre\",null,mdx(\"code\",e({parentName:\"pre\"},{className:\"language-python\"}),`@jit(['int32(int32, int32)',\n      'i4(int32, int64)',\n      '(f4, f8)',\n      'f8(f4, f4)'])\ndef func1(a, b):\n    return a + b\n`)),mdx(\"p\",null,\"In the above function, we passed function signatures as a list of strings. The syntax is return type is specified first and argument types are specified after. It is allowed to have no return type specified. Numba will infer the return type automatically and use that specification. Calling the function with argument types not provided in the list raises an error.\"),mdx(\"h2\",null,\"@njit or @jit(nopython=True)\"),mdx(\"p\",null,\"Numba \",mdx(\"strong\",{parentName:\"p\"},\"@jit\"),\" operates in two modes \",mdx(\"em\",{parentName:\"p\"},\"nopython\"),\" and \",mdx(\"em\",{parentName:\"p\"},\"object\"),\". In \",mdx(\"strong\",{parentName:\"p\"},\"nopython\"),\" mode, no interference of the Python interpreter is required and execution is very fast compared to normal mode. \",mdx(\"strong\",{parentName:\"p\"},\"object\"),\" mode is the same as calling function without \",mdx(\"strong\",{parentName:\"p\"},\"@jit\"),\".\"),mdx(\"p\",null,\"Normally with the \",mdx(\"strong\",{parentName:\"p\"},\"@jit\"),\" decorator, Numba tries to compile in \",mdx(\"strong\",{parentName:\"p\"},\"nopython\"),\" mode. If any part of the code cannot be compiled due to the presence of code that is not supported by Numba like a heterogenous dictionary, some string methods, etc, then Numba fallbacks to \",mdx(\"strong\",{parentName:\"p\"},\"object\"),\" or normal Python mode for compilation. But still, it will improve the performance when loops are involved. If there is no code to optimize, \",mdx(\"strong\",{parentName:\"p\"},\"@jit\"),\" in object mode runs slower than the normal Python version as Numba compilation involves several function call overheads.\"),mdx(\"p\",null,\"We can enable the strict \",mdx(\"em\",{parentName:\"p\"},\"nopython\"),\" mode by passing the option to \",mdx(\"strong\",{parentName:\"p\"},\"@jit\"),\" as \",mdx(\"em\",{parentName:\"p\"},\"@jit(nopython=True)\"),\". Numba also provides a separate decorator for this option. \",mdx(\"em\",{parentName:\"p\"},\"@njit\"),\" decorator is an alias for \",mdx(\"em\",{parentName:\"p\"},\"@jit(nopython=True)\"),\".\"),mdx(\"pre\",null,mdx(\"code\",e({parentName:\"pre\"},{className:\"language-python\"}),`@jit(nopython=True)\ndef f(a, b):\n    return a + b\n\n# or\n\n@njit\ndef f(a, b):\n    return a + b\n`)),mdx(\"p\",null,\"With \",mdx(\"strong\",{parentName:\"p\"},\"nopython\"),\" mode, if any code is present that requires object mode compilation, Numba will raise an error. The primary goal is to write functions that can be implemented in strict no-python mode.\"),mdx(\"hr\",null),mdx(\"h2\",null,\"Numba and Numpy\"),mdx(\"p\",null,\"Numba is best for Numpy arrays and supports some \",mdx(\"a\",e({parentName:\"p\"},{href:\"https://numba.readthedocs.io/en/stable/reference/numpysupported.html\"}),\"Numpy features\"),\" in no-python mode.\"),mdx(\"pre\",null,mdx(\"code\",e({parentName:\"pre\"},{className:\"language-python\"}),`@njit(['int64[:](int64[:, :], int64[:, :])'])\ndef f(a, b):\n    c = np.empty(a.shape[0], dtype='int64')\n\n    for i in range(a.shape[0]):\n        c[i] = a[i].sum() * b[i].sum()\n\n    return c\n`)),mdx(\"p\",null,\"The function takes 2 2D Numpy int64 arrays as arguments with the return type as an array of float64. The function calculates the sum of the product of the sum of each row of \",mdx(\"em\",{parentName:\"p\"},\"a\"),\" and \",mdx(\"em\",{parentName:\"p\"},\"b\"),\".\"),mdx(\"pre\",null,mdx(\"code\",e({parentName:\"pre\"},{className:\"language-python\"}),`x, y, n = 1000, 1000, 1_000_000\nl, h = 0, 100\na = np.random.randint(l, h, n).reshape(x, y)\nb = np.random.randint(l, h, n).reshape(x, y)\n`)),mdx(\"p\",null,\"If we compare both normal Numpy calculation of the above function and Numba compiled code,\"),mdx(\"pre\",null,mdx(\"code\",e({parentName:\"pre\"},{className:\"language-python\"}),`%%timeit\n# normal Python calculation\nres = a.sum(axis=1) * b.sum(axis=1)\n\n'''Output:\n1.4 ms \\xB1 7.1 \\xB5s per loop (mean \\xB1 std. dev. of 7 runs, 1000 loops each)\n'''\n`)),mdx(\"pre\",null,mdx(\"code\",e({parentName:\"pre\"},{className:\"language-python\"}),`%%timeit\n# Numba compiled function\nres = f(a, b)\n\n'''Output:\n1.19 ms \\xB1 15.4 \\xB5s per loop (mean \\xB1 std. dev. of 7 runs, 1000 loops each)\n'''\n`)),mdx(\"p\",null,\"Numba compiled version takes \",mdx(\"strong\",{parentName:\"p\"},\"1.19 ms\"),\" which is slightly faster than normal calculation with Numpy \",mdx(\"strong\",{parentName:\"p\"},\"1.4ms\"),\".\"),mdx(\"h2\",null,\"@vectorize decorator\"),mdx(\"p\",null,\"One of the main reasons for Numpy speed is that most of the Numpy functions are \",mdx(\"a\",e({parentName:\"p\"},{href:\"https://numpy.org/doc/stable/user/basics.ufuncs.html\"}),\"ufunc\"),\"s (universal functions) that are vectorized and implemented inside compiled layer of Numpy and hence the speed. We might run into a situation where we cannot find any existing Numpy functions for use and write a workaround by combining Numpy functions into a single operation. This new operation is not optimized and we might lose the speed that Numpy provides due to custom loops. To solve this problem, we can make any function as \",mdx(\"strong\",{parentName:\"p\"},\"ufunc\"),\" that comes with vectorization and speed.\"),mdx(\"p\",null,\"With \",mdx(\"a\",e({parentName:\"p\"},{href:\"https://numba.readthedocs.io/en/stable/user/vectorize.html\"}),\"@vectorize\"),\", Numba provides functionality to create custom vectorized universal functions. The universal function takes scalar values and returns a scalar value and these functions are applied over any Numpy arrays where array values are passed as single scalar values and an outside loop is automatically generated.\"),mdx(\"pre\",null,mdx(\"code\",e({parentName:\"pre\"},{className:\"language-python\"}),`@vectorize(['float64(int64, int64)'])\ndef v_expr(a, b):\n    return (a**2) + (a*3) + (b/2) + 10\n`)),mdx(\"p\",null,\"Here, we created a simple universal function that takes two scalar values and returns a calculated expression.\"),mdx(\"pre\",null,mdx(\"code\",e({parentName:\"pre\"},{className:\"language-python\"}),`n = 1_000_000\nl, h = 0, 100\na = np.random.randint(l, h, n)\nb = np.random.randint(l, h, n)\n`)),mdx(\"p\",null,\"The speed comparison of the Numpy expression and vectorized ufunc function gives\"),mdx(\"pre\",null,mdx(\"code\",e({parentName:\"pre\"},{className:\"language-python\"}),`%%timeit\n# general way of calculating Numpy expression\nres = (a**2) + (a*3) + (b/2) + 10\n\n'''Output:\n8.66 ms \\xB1 71.9 \\xB5s per loop (mean \\xB1 std. dev. of 7 runs, 100 loops each)\n'''\n`)),mdx(\"pre\",null,mdx(\"code\",e({parentName:\"pre\"},{className:\"language-python\"}),`%%timeit\n# calculate expression with ufunc\nres = v_expr(a, b)\n\n'''Output:\n2.17 ms \\xB1 96.5 \\xB5s per loop (mean \\xB1 std. dev. of 7 runs, 100 loops each)\n'''\n`)),mdx(\"p\",null,\"the optimized function \",mdx(\"strong\",{parentName:\"p\"},\"v_expr\"),\" takes \",mdx(\"strong\",{parentName:\"p\"},\"2.17 ms\"),\" which is 4x faster than the normal calculation with Numpy.\"),mdx(\"hr\",null),mdx(\"p\",null,\"In this blog, we discussed basic Numba decorators and compared Numba compiled functions with normal Python functions. Explore other features of Numba like\"),mdx(\"ul\",null,mdx(\"li\",{parentName:\"ul\"},mdx(\"a\",e({parentName:\"li\"},{href:\"https://numba.readthedocs.io/en/stable/user/parallel.html\"}),\"automatic parallelization\")),mdx(\"li\",{parentName:\"ul\"},mdx(\"a\",e({parentName:\"li\"},{href:\"https://numba.readthedocs.io/en/stable/user/parallel.html#explicit-parallel-loops\"}),\"loop parallelization with prange\")),mdx(\"li\",{parentName:\"ul\"},mdx(\"a\",e({parentName:\"li\"},{href:\"https://numba.readthedocs.io/en/stable/user/stencil.html\"}),\"stencil kernel implementation for arrays\")),mdx(\"li\",{parentName:\"ul\"},mdx(\"a\",e({parentName:\"li\"},{href:\"https://numba.readthedocs.io/en/stable/user/pycc.html\"}),\"ahead-of-time compilation\"))),mdx(\"p\",null,\"Remember that not every function can be passed to Numba as there are some limitations like\"),mdx(\"ul\",null,mdx(\"li\",{parentName:\"ul\"},\"Numba only supports a subset of Python code like classes, multi-dimensional dictionaries, etc, which are not supported yet.\"),mdx(\"li\",{parentName:\"ul\"},\"As object mode compilation takes more time than the normal Python mode in some cases, it is better to check the speed of both normal and compiled code execution speed.\"),mdx(\"li\",{parentName:\"ul\"},\"Support for external libraries like Pandas is not supported.\"),mdx(\"li\",{parentName:\"ul\"},\"As Numba re-implements some Numpy APIs, there may be different behavior expected.\")),mdx(\"hr\",null),mdx(\"h3\",null,\"References\"),mdx(\"ul\",null,mdx(\"li\",{parentName:\"ul\"},mdx(\"a\",e({parentName:\"li\"},{href:\"https://github.com/ContinuumIO/gtc2020-numba\"}),\"https://github.com/ContinuumIO/gtc2020-numba\")),mdx(\"li\",{parentName:\"ul\"},mdx(\"a\",e({parentName:\"li\"},{href:\"https://www.nvidia.com/en-us/glossary/data-science/numba/\"}),\"https://www.nvidia.com/en-us/glossary/data-science/numba/\")),mdx(\"li\",{parentName:\"ul\"},mdx(\"a\",e({parentName:\"li\"},{href:\"https://www.chrisvoncsefalvay.com/2019/03/23/jit-fast/\"}),\"https://www.chrisvoncsefalvay.com/2019/03/23/jit-fast/\")),mdx(\"li\",{parentName:\"ul\"},mdx(\"a\",e({parentName:\"li\"},{href:\"https://towardsdatascience.com/numba-weapon-of-mass-optimization-43cdeb76c7da\"}),\"https://towardsdatascience.com/numba-weapon-of-mass-optimization-43cdeb76c7da\")),mdx(\"li\",{parentName:\"ul\"},mdx(\"a\",e({parentName:\"li\"},{href:\"https://www.infoworld.com/article/3622013/speed-up-your-python-with-numba.html\"}),\"https://www.infoworld.com/article/3622013/speed-up-your-python-with-numba.html\")),mdx(\"li\",{parentName:\"ul\"},mdx(\"a\",e({parentName:\"li\"},{href:\"https://coderzcolumn.com/tutorials/python/numba\"}),\"https://coderzcolumn.com/tutorials/python/numba\")),mdx(\"li\",{parentName:\"ul\"},mdx(\"a\",e({parentName:\"li\"},{href:\"https://towardsdatascience.com/numpy-ufuncs-the-magic-behind-vectorized-functions-8cc3ba56aa2c\"}),\"https://towardsdatascience.com/numpy-ufuncs-the-magic-behind-vectorized-functions-8cc3ba56aa2c\"))))}MDXContent.isMDXComponent=!0;\n","scope":{}},"id":"super-fast-python-numba"},"__N_SSG":true}