{"pageProps":{"postMetadata":{"title":"Create a Notes App with Flutter","description":"Create a color-rich Note-taking app with Flutter.","imgName":"note-app-flutter/note-app-in-flutter.jpg","date":"Jun 15, 2021","tags":["flutter"],"keywords":["flutter","dart","android","note-app","note-taking","sqflite","sqlite"],"id":"create-a-notes-app-with-flutter"},"postContent":{"compiledSource":"var c=Object.defineProperty,g=Object.defineProperties;var h=Object.getOwnPropertyDescriptors;var r=Object.getOwnPropertySymbols;var s=Object.prototype.hasOwnProperty,i=Object.prototype.propertyIsEnumerable;var l=(t,a,o)=>a in t?c(t,a,{enumerable:!0,configurable:!0,writable:!0,value:o}):t[a]=o,e=(t,a)=>{for(var o in a||(a={}))s.call(a,o)&&l(t,o,a[o]);if(r)for(var o of r(a))i.call(a,o)&&l(t,o,a[o]);return t},d=(t,a)=>g(t,h(a));var p=(t,a)=>{var o={};for(var n in t)s.call(t,n)&&a.indexOf(n)<0&&(o[n]=t[n]);if(t!=null&&r)for(var n of r(t))a.indexOf(n)<0&&i.call(t,n)&&(o[n]=t[n]);return o};const layoutProps={},MDXLayout=\"wrapper\";function MDXContent(o){var n=o,{components:t}=n,a=p(n,[\"components\"]);return mdx(MDXLayout,d(e(e({},layoutProps),a),{components:t,mdxType:\"MDXLayout\"}),mdx(\"p\",null,mdx(\"img\",e({parentName:\"p\"},{src:\"note-app-flutter/note-app-in-flutter.jpg\",alt:\"Create a Notes App with flutter\"}))),mdx(\"h6\",null,\"Published on: \",mdx(\"strong\",{parentName:\"h6\"},\"Jun 15, 2021\")),mdx(\"h1\",null,\"Create a Note-taking App in Flutter\"),mdx(\"p\",null,\"Flutter is a declarative framework that requires programming in Dart. Flutter is suitable for creating simple apps like Note-taking, Event-registration, etc.\"),mdx(\"blockquote\",null,mdx(\"p\",{parentName:\"blockquote\"},\"Pre-requisites: Knowledge of basic Dart and Flutter. Read about \",mdx(\"a\",e({parentName:\"p\"},{href:\"https://flutter.dev/docs\"}),\"Flutter\"),\" and \",mdx(\"a\",e({parentName:\"p\"},{href:\"https://dart.dev/guides\"}),\"Dart\"),\".\")),mdx(\"p\",null,\"With basic concepts like Widgets and Material design we can create simple apps very fast and easily in Flutter as in Flutter we can use tons of pre-designed widgets to create almost every popular design using in the modern design world.\"),mdx(\"p\",null,\"In this tutorial, we discuss creating a simple note-taking app. The note-taking app we are going to create provides options like create, save, update and delete notes. \"),mdx(\"p\",null,\"Our note-taking app contains two screens \"),mdx(\"ul\",null,mdx(\"li\",{parentName:\"ul\"},\"Home screen to display all saved notes\"),mdx(\"li\",{parentName:\"ul\"},\"Notes edit screen to create new notes or edit saved notes\")),mdx(\"h2\",null,\"Create Flutter App\"),mdx(\"p\",null,\"Before creating a Flutter app please make sure you have installed flutter-sdk and dart-sdk. If not follow the instructions to \",mdx(\"a\",e({parentName:\"p\"},{href:\"https://flutter.dev/docs/get-started/install\"}),\"install flutter\"),\".\"),mdx(\"p\",null,\"Create a raw flutter app from the terminal. Run the following command and pass any name (to join more than single sting use only underscore)\"),mdx(\"pre\",null,mdx(\"code\",e({parentName:\"pre\"},{className:\"language-bash\"}),`flutter create notes_app\n`)),mdx(\"p\",null,\"Go to root directory of \",mdx(\"strong\",{parentName:\"p\"},\"notes_app\"),\" and locate \",mdx(\"strong\",{parentName:\"p\"},\"main.dart\"),\" in \",mdx(\"strong\",{parentName:\"p\"},\"lib\"),\" folder. This is where our app starts execution by calling the main() function. You can find some code here which displays the welcome screen.\"),mdx(\"p\",null,\"Now to see the app in an emulator or on a physical device run the below command.\"),mdx(\"pre\",null,mdx(\"code\",e({parentName:\"pre\"},{className:\"language-bash\"}),`cd notes_app/\nflutter run\n`)),mdx(\"p\",null,\"For the initial run, it takes some time to install the app on the device, and later builds will be fast. If you encounter any error run \",mdx(\"em\",{parentName:\"p\"},\"flutter doctor -v\"),\" for additional information and make sure all necessary items are checked.\"),mdx(\"hr\",null),mdx(\"h2\",null,\"What a Note should like and contain?\"),mdx(\"p\",null,\"A simple note must have a title and the content which can be edited as many times as possible. We can also add color to note for look and feel. \"),mdx(\"p\",null,\"To store notes we use \",mdx(\"a\",e({parentName:\"p\"},{href:\"https://pub.dev/packages/sqflite\"}),\"Sqflite\"),\" (a plugin to mimic SQL database in Flutter). Each note can be stored as a single row in the database with fields id, title, content, color. \"),mdx(\"p\",null,\"Create a file \",mdx(\"strong\",{parentName:\"p\"},\"note.dart\"),\" inside \",mdx(\"strong\",{parentName:\"p\"},\"lib/models\"),\". Add a class \",mdx(\"strong\",{parentName:\"p\"},\"Note\"),\" to store note as an object which can be converted later as a Map object to store in the database.\"),mdx(\"pre\",null,mdx(\"code\",e({parentName:\"pre\"},{className:\"language-dart:models/note.dart\"}),`class Note {\n    int id;\n    String title;\n    String content;\n    String noteColor;\n\n    Note({\n        this.id = null, \n        this.title = \"Note\", \n        this.content = \"Text\", \n        this.noteColor = 'red'\n    });\n\n    Map<String, dynamic> toMap() {\n        Map<String, dynamic> data = Map<String, dynamic>();\n        if (id != null) {\n            data['id'] = id;\n        }\n        data['title'] = title;\n        data['content'] = content;\n        data['noteColor'] = noteColor;\n        return data;\n    }\n\n    @override toString() {\n        return {\n            'id': id,\n            'title': title,\n            'content': content,\n            'noteColor': noteColor,\n        }.toString();\n    }\n}\n`)),mdx(\"p\",null,\"This Note class has attributes\"),mdx(\"ul\",null,mdx(\"li\",{parentName:\"ul\"},\"id (primary key) - an identifier to store unique note objects in the database\"),mdx(\"li\",{parentName:\"ul\"},\"title - the title of the note\"),mdx(\"li\",{parentName:\"ul\"},\"content - content of the note\"),mdx(\"li\",{parentName:\"ul\"},\"noteColor - the color of the note\")),mdx(\"p\",null,mdx(\"strong\",{parentName:\"p\"},\"toMap()\"),\" returns note as an object to store in the database.\"),mdx(\"p\",null,\"For note colors, add another file called \",mdx(\"strong\",{parentName:\"p\"},\"theme/note_colors.dart\"),\" inside \",mdx(\"strong\",{parentName:\"p\"},\"lib/theme\"),\".\"),mdx(\"pre\",null,mdx(\"code\",e({parentName:\"pre\"},{className:\"language-dart:theme/note_colors.dart\"}),`const NoteColors = {\n    'red': {'l': 0xFFFFCDD2,'b': 0xFFE57373},\n    'pink': {'l': 0xFFF8BBD0, 'b': 0xFFF06292},\n    'purple': {'l': 0xFFE1BEE7, 'b': 0xFFBA68C8},\n    'deepPurple': {'l': 0xFFD1C4E9, 'b': 0xFF9575CD},\n    'indigo': {'l': 0xFFC5CAE9, 'b': 0xFF7986CB},\n    'blue': {'l': 0xFFBBDEFB, 'b': 0xFF64B5F6},\n    'lightBlue': {'l': 0xFFB3E5FC, 'b': 0xFF4FC3F7},\n    'cyan': {'l': 0xFFB2EBF2, 'b': 0xFF4DD0E1},\n    'teal': {'l': 0xFFB2DFDB, 'b': 0xFF4DB6AC},\n    'green': {'l': 0xFFC8E6C9, 'b': 0xFF81C784},\n    'lightGreen': {'l': 0xFFDCEDC8, 'b': 0xFFAED581},\n    'lime': {'l': 0xFFF0F4C3, 'b': 0xFFDCE775},\n    'yellow': {'l': 0xFFFFF9C4, 'b': 0xFFFFF176},\n    'amber': {'l': 0xFFFFECB3, 'b': 0xFFFFD54F},\n    'orange': {'l': 0xFFFFE0B2, 'b': 0xFFFFB74D},\n    'deepOrange': {'l': 0xFFFFCCBC, 'b': 0xFFFF8A65},\n    'brown': {'l': 0xFFD7CCCB, 'b': 0xFFA1887F},\n    'blueGray': {'l': 0xFFCFD8DC, 'b': 0xFF90A4AE},\n};\n`)),mdx(\"p\",null,\"Each color name ('k') is a key and each key ('k') has two colors 'l' and 'b', where 'l' is a light color and 'b' is the bright color of this 'k' color. The light and bright colors are used to display a note in the UI which we discuss later. 'k' is the color name we store in the database.\"),mdx(\"hr\",null),mdx(\"h2\",null,\"Store notes in the database\"),mdx(\"p\",null,\"Now to store notes on the database we use \",mdx(\"strong\",{parentName:\"p\"},\"sqflite\"),\" plugin. Install \",mdx(\"strong\",{parentName:\"p\"},\"sqflite\"),\" by adding dependency in \",mdx(\"em\",{parentName:\"p\"},\"pubspec.yaml\"),\".\"),mdx(\"pre\",null,mdx(\"code\",e({parentName:\"pre\"},{className:\"language-bash\"}),`dependencies:\n  flutter:\n    sdk: flutter\n  sqflite: ^1.3.0\n`)),mdx(\"p\",null,\"Now in terminal run \",mdx(\"em\",{parentName:\"p\"},\"flutter pub get\"),\" to install or update dependencies in \",mdx(\"em\",{parentName:\"p\"},\"pubspec.yaml\"),\".\"),mdx(\"p\",null,\"To handle database operations we write different functions for different operations like read, write, update and delete. Create \",mdx(\"strong\",{parentName:\"p\"},\"notes_database.dart\"),\" inside \",mdx(\"strong\",{parentName:\"p\"},\"models\"),\" and add a class to handle different operations\"),mdx(\"pre\",null,mdx(\"code\",e({parentName:\"pre\"},{className:\"language-dart:models/notes_database.dart\"}),`import 'package:sqflite/sqflite.dart';\n\nimport 'note.dart';\n\nclass NotesDatabase {\n    static final _name = \"NotesDatabase.db\";\n    static final _version = 1;\n\n    Database database;\n    static final tableName = 'notes';\n\n    initDatabase() async {\n        database = await openDatabase(\n            _name,\n            version: _version,\n            onCreate: (Database db, int version) async {\n                await db.execute(\n                    '''CREATE TABLE $tableName (\n                    id INTEGER PRIMARY KEY AUTOINCREMENT,\n                    title TEXT,\n                    content TEXT,\n                    noteColor TEXT\n                    )'''\n                );\n            }\n        );\n    }\n\n    Future<int> insertNote(Note note) async {\n        return await database.insert(tableName, \n            note.toMap(), \n            conflictAlgorithm: ConflictAlgorithm.replace\n        );\n    }\n\n    Future<int> updateNote(Note note) async {\n        return await database.update(tableName, note.toMap(),\n            where: 'id = ?', \n            whereArgs: [note.id],\n            conflictAlgorithm: ConflictAlgorithm.replace\n        );\n    }\n\n    Future<List<Map<String, dynamic>>> getAllNotes() async {\n        return await database.query(tableName);\n    }\n\n    Future<Map<String, dynamic>> getNotes(int id) async {\n        var result = await database.query(tableName,\n            where: 'id = ?',\n            whereArgs: [id]\n        );\n\n        if (result.length > 0) {\n            return result.first;\n        }\n\n        return null;\n    }\n\n    Future<int> deleteNote(int id) async {\n        return await database.delete(tableName,\n            where: 'id = ?',\n            whereArgs: [id]\n        );\n    }\n\n    closeDatabase() async {\n        await database.close();\n    }\n}\n`)),mdx(\"p\",null,\"First, we need to create a table in the database with some schema. Inside \",mdx(\"strong\",{parentName:\"p\"},\"initDatabase()\"),\", we are calling \",mdx(\"strong\",{parentName:\"p\"},\"openDatabase()\"),\" to create database and table or open existing database and table by passing parameters \",mdx(\"strong\",{parentName:\"p\"},\"_name\"),\" (name of the database) and \",mdx(\"strong\",{parentName:\"p\"},\"_version\"),\" where \",mdx(\"strong\",{parentName:\"p\"},\"_name = NotesDatabse.db\"),\" is the name of the database and we can maintain different versions of the database through \",mdx(\"strong\",{parentName:\"p\"},\"_version\"),\". \"),mdx(\"p\",null,\"If there is no database with a specified \",mdx(\"strong\",{parentName:\"p\"},\"name\"),\", \",mdx(\"strong\",{parentName:\"p\"},\"onCreate\"),\" callback is called to create a database with table and schema. Above we create a table with \",mdx(\"strong\",{parentName:\"p\"},\"tableName = notes\"),\" and initial schema with required fields like id, title, content, and noteColor to store a note object. \"),mdx(\"p\",null,mdx(\"strong\",{parentName:\"p\"},\"openDatabase()\"),\" is an async operation and returns \",mdx(\"strong\",{parentName:\"p\"},\"Database\"),\" object reference which points to the created/existed database. We store this reference as \",mdx(\"strong\",{parentName:\"p\"},\"database\"),\" of type class \",mdx(\"strong\",{parentName:\"p\"},\"Database\"),\".\"),mdx(\"p\",null,\"Other functions \",mdx(\"strong\",{parentName:\"p\"},\"insertNote\"),\", \",mdx(\"strong\",{parentName:\"p\"},\"updateNote\"),\", \",mdx(\"strong\",{parentName:\"p\"},\"getNotes\"),\" and \",mdx(\"strong\",{parentName:\"p\"},\"deleteNotes\"),\" handles different database operations. Read more about \",mdx(\"a\",e({parentName:\"p\"},{href:\"https://github.com/tekartik/sqflite/blob/master/sqflite/doc/how_to.md\"}),\"how to perform different operations in sqflite\"),\".\"),mdx(\"p\",null,\"As we cannot store Note as a class object we convert Note object members to a Map object by calling Note.toMap() which returns a Map object which sqflite map fields and values to store in the database. And Sqflite returns data as Map objects the way we pass it to insert rows in the database.\"),mdx(\"p\",null,\"We have added logic to maintain notes in the database. But we have not done anything in UI to interact for maintaining notes. \"),mdx(\"h2\",null,\"Add Home Screen\"),mdx(\"p\",null,\"Now create a file called \",mdx(\"strong\",{parentName:\"p\"},\"home.dart\"),\" in \",mdx(\"strong\",{parentName:\"p\"},\"lib/screens\"),\". This \",mdx(\"strong\",{parentName:\"p\"},\"home.dart\"),\" serves as the Home screen of our app. Add following code to \",mdx(\"strong\",{parentName:\"p\"},\"home.dart\")),mdx(\"pre\",null,mdx(\"code\",e({parentName:\"pre\"},{className:\"language-dart:screens/home.dart\"}),`import 'package:flutter/material.dart';\n\nconst c1 = 0xFFFDFFFC, c2 = 0xFFFF595E, c3 = 0xFF374B4A, c4 = 0xFF00B1CC, c5 = 0xFFFFD65C, c6 = 0xFFB9CACA,\n    c7 = 0x80374B4A, c8 = 0x3300B1CC, c9 = 0xCCFF595E;\n\n// Home Screen\nclass Home extends StatefulWidget{\n    @override\n    _Home createState() => _Home();\n}\n\nclass _Home extends State<Home> {\n    @override\n    Widget build(BuildContext context) {\n        return MaterialApp(\n            title: 'Super Note',\n            home: Scaffold(\n                backgroundColor: Color(c6),\n                appBar: AppBar(\n                    automaticallyImplyLeading: false,\n                    backgroundColor: const Color(c2),\n                    brightness: Brightness.dark,\n\n                    title: Text(\n                        'Super Note',\n                        style: TextStyle(\n                            color: const Color(c5),\n                        ),\n                    ),\n                ),\n\n                //Floating Button\n                floatingActionButton: FloatingActionButton(\n                    child: const Icon(\n                        Icons.add,\n                        color: const Color(c5),\n                    ),\n                    tooltip: 'New Notes',\n                    backgroundColor: const Color(c4),\n                    onPressed: () => {},\n                ),\n            ),\n        );\n    }\n}\n`)),mdx(\"p\",null,\"There are some color constants defined at the top which will be used across the app. The color format in Flutter is different from normal Hex. In normal Hex format, we provide opacity at last but in Flutter we have to provide opacity at first.\"),mdx(\"p\",null,\"Here we are creating a Home widget as \",mdx(\"strong\",{parentName:\"p\"},\"StatefulWidget\"),\" keeping in mind that we need to maintain the state. Every custom widget must override \",mdx(\"strong\",{parentName:\"p\"},\"build\"),\" method and return a widget. \",mdx(\"strong\",{parentName:\"p\"},\"MaterialApp\"),\" widget gives child widgets material look and we must declare required attributes. \",mdx(\"strong\",{parentName:\"p\"},\"Scaffold\"),\" widget is a common material design concept that provides appbar, floating button, drawer, body, etc.  \"),mdx(\"p\",null,\"The Home screen displays all notes stored in the database. We discuss later displaying notes in the Home screen after creating notes in the Edit screen.\"),mdx(\"p\",null,\"To display our Home screen as default screen in our app call \",mdx(\"strong\",{parentName:\"p\"},\"Home()\"),\" widget inside \",mdx(\"strong\",{parentName:\"p\"},\"MyApp\"),\" in \",mdx(\"strong\",{parentName:\"p\"},\"main.dart\")),mdx(\"pre\",null,mdx(\"code\",e({parentName:\"pre\"},{className:\"language-dart:main.dart\"}),`import 'package:flutter/material.dart';\n\nimport './screens/home.dart';\n\nvoid main() => runApp(MyApp());\n\nclass MyApp extends StatelessWidget {\n  @override\n  Widget build(BuildContext context) {\n    return MaterialApp(\n      home: Home(),\n    );\n  }\n}\n`)),mdx(\"p\",null,\"To see the changes in the app, in the flutter running environment press \",mdx(\"strong\",{parentName:\"p\"},\"r\"),\" to hot reload or \",mdx(\"strong\",{parentName:\"p\"},\"R\"),\" restart of the app.\"),mdx(\"p\",null,mdx(\"img\",e({parentName:\"p\"},{src:\"note-app-flutter/notes-app-initial-home-screen.jpg\",alt:\"Home Screen:=:30\"}))),mdx(\"p\",null,\"The Floating action button at the bottom-right will take us to the Edit screen to create a new note. To add navigation from Home to Edit, first create a Edit Screen Widget in \",mdx(\"strong\",{parentName:\"p\"},\"notes_edit.dart\"),\" inside \",mdx(\"strong\",{parentName:\"p\"},\"lib/screens\"),\". For now, add a simple UI for the Edit screen like below because we just need a widget to route from Home to Edit screen.\"),mdx(\"pre\",null,mdx(\"code\",e({parentName:\"pre\"},{className:\"language-dart:screens/notes_edit.dart\"}),`import 'package:flutter/material.dart';\n\nconst c1 = 0xFFFDFFFC, c2 = 0xFFFF595E, c3 = 0xFF374B4A, c4 = 0xFF00B1CC, c5 = 0xFFFFD65C, c6 = 0xFFB9CACA,\n            c7 = 0x80374B4A;\n\nclass NotesEdit extends StatefulWidget {\n    _NotesEdit createState() => _NotesEdit();\n}\n\nclass _NotesEdit extends State<NotesEdit> {\n    @override\n    Widget build(BuildContext context) {\n        return MaterialApp(\n            title: 'Edit Screen',\n            home: Text(\n                'Edit'\n            ),\n        );\n    }\n}\n`)),mdx(\"p\",null,mdx(\"strong\",{parentName:\"p\"},\"NotesEdit\"),\" widget is the main widget for the Edit screen. We call this widget in navigation.\"),mdx(\"h3\",null,\"Navigation from Home to Edit\"),mdx(\"p\",null,\"Add navigation from Home to Edit when pressed floating-action-buttton. Call \",mdx(\"strong\",{parentName:\"p\"},\"Navigation.push()\"),\" for the \",mdx(\"strong\",{parentName:\"p\"},\"EditNotes\"),\" widget. In \",mdx(\"strong\",{parentName:\"p\"},\"home.dart\"),\" add navigation in \",mdx(\"strong\",{parentName:\"p\"},\"onPressed()\"),\" event of floating-action-button.\"),mdx(\"pre\",null,mdx(\"code\",e({parentName:\"pre\"},{className:\"language-dart\"}),`import './notes_edit.dart';\n`)),mdx(\"pre\",null,mdx(\"code\",e({parentName:\"pre\"},{className:\"language-dart\"}),`//Floating Button\nfloatingActionButton: FloatingActionButton(\n    child: const Icon(\n        Icons.add,\n        color: const Color(c5),\n    ),\n    tooltip: 'New Notes',\n    backgroundColor: const Color(c4),\n    // Go to Edit screen\n    onPressed: () {\n      Navigator.push(\n        context,     \n        MaterialPageRoute(builder: (context) => NotesEdit()),\n      );\n    }\n),\n`)),mdx(\"hr\",null),mdx(\"h2\",null,\"Change Edit Screen\"),mdx(\"p\",null,\"Change Edit screen UI for creating a new note.\"),mdx(\"pre\",null,mdx(\"code\",e({parentName:\"pre\"},{className:\"language-dart:screens/notes_edit.dart\"}),`import 'package:flutter/material.dart';\n\nimport '../models/note.dart';\nimport '../models/notes_database.dart';\nimport '../theme/note_colors.dart';\n\nconst c1 = 0xFFFDFFFC, c2 = 0xFFFF595E, c3 = 0xFF374B4A, c4 = 0xFF00B1CC, c5 = 0xFFFFD65C, c6 = 0xFFB9CACA,\n    c7 = 0x80374B4A;\n\nclass NotesEdit extends StatefulWidget {\n    _NotesEdit createState() => _NotesEdit();\n}\n\nclass _NotesEdit extends State<NotesEdit> {\n    String noteTitle = '';\n    String noteContent = '';\n    String noteColor = 'red';\n\n    TextEditingController _titleTextController = TextEditingController();\n    TextEditingController _contentTextController = TextEditingController();\n\n    void handleTitleTextChange() {\n        setState(() {\n            noteTitle = _titleTextController.text.trim();\n        });\n    }\n\n    void handleNoteTextChange() {\n        setState(() {\n            noteContent = _contentTextController.text.trim();\n        });\n    }\n\n    @override\n    void initState() {\n        super.initState();\n        _titleTextController.addListener(handleTitleTextChange);\n        _contentTextController.addListener(handleNoteTextChange);\n    }\n\n    @override\n    void dispose() {\n        _titleTextController.dispose();\n        _contentTextController.dispose();\n        super.dispose();\n    }\n\n    @override\n    Widget build(BuildContext context) {\n        return Scaffold(\n            backgroundColor: Color(NoteColors[this.noteColor]['l']),\n            appBar: AppBar(\n                backgroundColor: Color(NoteColors[this.noteColor]['b']),\n\n                leading: IconButton(\n                    icon: const Icon(\n                        Icons.arrow_back,\n                        color: const Color(c1),\n                    ),\n                    tooltip: 'Back',\n                    onPressed: () => {},\n                ),\n\n                title: NoteTitleEntry(_titleTextController),\n            ),\n\n            body: NoteEntry(_contentTextController),\n        );\n    }\n}\n`)),mdx(\"p\",null,\"In the above \",mdx(\"strong\",{parentName:\"p\"},\"NotesEdit\"),\" widget, the state variables \",mdx(\"strong\",{parentName:\"p\"},\"noteTitle\"),\", \",mdx(\"strong\",{parentName:\"p\"},\"noteContent\"),\" and \",mdx(\"strong\",{parentName:\"p\"},\"noteColor\"),\" are initialized to default values for now. \",mdx(\"strong\",{parentName:\"p\"},\"noteTitel\"),\" is to store title of the note, \",mdx(\"strong\",{parentName:\"p\"},\"noteContent\"),\" is to store note content and\",mdx(\"strong\",{parentName:\"p\"},\"noteColor\"),\" is color of the color, light and bright colors of the \",mdx(\"strong\",{parentName:\"p\"},\"noteColor\"),\" are used as \",mdx(\"strong\",{parentName:\"p\"},\"backgroundColor\"),\" for \",mdx(\"strong\",{parentName:\"p\"},\"appBar\"),\" and \",mdx(\"strong\",{parentName:\"p\"},\"Scaffold\"),\" respectively. \"),mdx(\"p\",null,\"Also there are two \",mdx(\"strong\",{parentName:\"p\"},\"TextEditingController\"),\" defined which are used to controll \",mdx(\"strong\",{parentName:\"p\"},\"TextField\"),\" values for \",mdx(\"strong\",{parentName:\"p\"},\"noteTitle\"),\" and \",mdx(\"strong\",{parentName:\"p\"},\"noteContent\"),\". These two text controller are attached with listeners in \",mdx(\"strong\",{parentName:\"p\"},\"iniitState()\"),\". These listeneres listen to changes and updates text values in state. \",mdx(\"strong\",{parentName:\"p\"},\"_titleTextController\"),\" handles and updates text value for \",mdx(\"strong\",{parentName:\"p\"},\"noteTitle\"),\" and \",mdx(\"strong\",{parentName:\"p\"},\"_contentTextController\"),\" handles \",mdx(\"strong\",{parentName:\"p\"},\"noteContent\"),\".\"),mdx(\"p\",null,\"The \",mdx(\"strong\",{parentName:\"p\"},\"title\"),\" of the \",mdx(\"strong\",{parentName:\"p\"},\"appBar\"),\" is set to a widget \",mdx(\"strong\",{parentName:\"p\"},\"NoteTitleEntry\"),\" which handles displaying and editing of the title.\"),mdx(\"pre\",null,mdx(\"code\",e({parentName:\"pre\"},{className:\"language-dart\"}),`class NoteTitleEntry extends StatelessWidget {\n    final _textFieldController;\n\n    NoteTitleEntry(this._textFieldController);\n\n    @override\n    Widget build(BuildContext context) {\n        return TextField(\n            controller: _textFieldController,\n            decoration: InputDecoration(\n                border: InputBorder.none,\n                focusedBorder: InputBorder.none,\n                enabledBorder: InputBorder.none,\n                errorBorder: InputBorder.none,\n                disabledBorder: InputBorder.none,\n                contentPadding: EdgeInsets.all(0),\n                counter: null,\n                counterText: \"\",\n                hintText: 'Title',\n                hintStyle: TextStyle(\n                    fontSize: 21,\n                    fontWeight: FontWeight.bold,\n                    height: 1.5,\n                ),\n            ),\n            maxLength: 31,\n            maxLines: 1,\n            style: TextStyle(\n                fontSize: 21,\n                fontWeight: FontWeight.bold,\n                height: 1.5,\n                color: Color(c1),\n            ),\n            textCapitalization: TextCapitalization.words,\n        );\n    }   \n}\n`)),mdx(\"p\",null,\"In the \",mdx(\"strong\",{parentName:\"p\"},\"TextField\"),\", the controller is set to \",mdx(\"strong\",{parentName:\"p\"},\"_textFieldController\"),\" which is passed from parent widget \",mdx(\"strong\",{parentName:\"p\"},\" as \"),\"_titleTextController**. \"),mdx(\"p\",null,\"Similarly, content of the notes is handled by another widget \",mdx(\"strong\",{parentName:\"p\"},\"NoteEntry\"),\".\"),mdx(\"pre\",null,mdx(\"code\",e({parentName:\"pre\"},{className:\"language-dart\"}),`class NoteEntry extends StatelessWidget {\n    final _textFieldController;\n\n    NoteEntry(this._textFieldController);\n\n    @override\n    Widget build(BuildContext context) {\n        return Container(\n            height: MediaQuery.of(context).size.height,\n            padding: EdgeInsets.symmetric(horizontal: 12, vertical: 8),\n            child: TextField(\n                controller: _textFieldController,\n                maxLines: null,\n                textCapitalization: TextCapitalization.sentences,\n                decoration: null,\n                style: TextStyle(\n                    fontSize: 19,\n                    height: 1.5,\n                ),\n            ),\n        );\n    }\n}\n`)),mdx(\"p\",null,\"Here also controller of \",mdx(\"strong\",{parentName:\"p\"},\"TextField\"),\" is set to \",mdx(\"strong\",{parentName:\"p\"},\"_textFieldController\"),\" which is passed from parent wdiget as \",mdx(\"strong\",{parentName:\"p\"},\"_contentTextController\"),\".\"),mdx(\"p\",null,\"After adding all these widgets, the Edit screen would look like\"),mdx(\"p\",null,mdx(\"img\",e({parentName:\"p\"},{src:\"note-app-flutter/notes-app-initial-edit-screen.jpg\",alt:\"Edit screen:=:30\"}))),mdx(\"h3\",null,\"Add a Color palette to select Note color\"),mdx(\"p\",null,\"We will add a color palette to select note color and store the value in \",mdx(\"strong\",{parentName:\"p\"},\"noteColor\"),\". For color palette, add an icon in \",mdx(\"strong\",{parentName:\"p\"},\"appBar\"),\" \",mdx(\"strong\",{parentName:\"p\"},\"actions\"),\" which on press shows a \",mdx(\"strong\",{parentName:\"p\"},\"Dialog\"),\" box with different colors.\"),mdx(\"p\",null,\"In \",mdx(\"strong\",{parentName:\"p\"},\"NotesEdit\"),\" add color palette button\"),mdx(\"pre\",null,mdx(\"code\",e({parentName:\"pre\"},{className:\"language-dart\"}),`actions: [\n    IconButton(\n        icon: const Icon(\n            Icons.color_lens,\n            color: const Color(c1),\n        ),\n        tooltip: 'Color Palette',\n        onPressed: () => handleColor(context),\n    ),\n],\n`)),mdx(\"p\",null,\"For this button, \",mdx(\"strong\",{parentName:\"p\"},\"onPressed\"),\" event calls \",mdx(\"strong\",{parentName:\"p\"},\"handleColor()\"),\" function which shows a color palette and store selected value in \",mdx(\"strong\",{parentName:\"p\"},\"noteColor\"),\" variable. Define \",mdx(\"strong\",{parentName:\"p\"},\"handleColor()\"),\" inside \",mdx(\"strong\",{parentName:\"p\"},\"_NotesEdit\")),mdx(\"pre\",null,mdx(\"code\",e({parentName:\"pre\"},{className:\"language-dart\"}),`void handleColor(currentContext) {\n    showDialog(\n        context: currentContext,\n        builder: (context) => ColorPalette(\n            parentContext: currentContext,\n        ),\n    ).then((colorName) {\n        if (colorName != null) {\n            setState(() {\n                noteColor = colorName;\n            });\n        }\n    });\n}\n`)),mdx(\"p\",null,\"This \",mdx(\"strong\",{parentName:\"p\"},\"handleColor()\"),\" calls widget \",mdx(\"strong\",{parentName:\"p\"},\"ColorPalette\"),\" which is a \",mdx(\"strong\",{parentName:\"p\"},\"Dialog\"),\" box and returns selected color value. Add \",mdx(\"strong\",{parentName:\"p\"},\"ColorPalette\"),\" widget to show different colors and return selected color\"),mdx(\"pre\",null,mdx(\"code\",e({parentName:\"pre\"},{className:\"language-dart\"}),`class ColorPalette extends StatelessWidget {\n    final parentContext;\n\n    const ColorPalette({ \n        @required this.parentContext,\n    });\n\n    @override\n    Widget build(BuildContext context) {\n        return Dialog(\n            backgroundColor: Color(c1),\n            clipBehavior: Clip.hardEdge,\n            insetPadding: EdgeInsets.all(MediaQuery.of(context).size.width * 0.03),\n            shape: RoundedRectangleBorder(\n                borderRadius: BorderRadius.circular(2),\n            ),\n            child: Container(\n                padding: EdgeInsets.all(8),\n                child: Wrap(\n                    alignment: WrapAlignment.start,\n                    spacing: MediaQuery.of(context).size.width * 0.02,\n                    runSpacing: MediaQuery.of(context).size.width * 0.02,\n                    children: NoteColors.entries.map((entry) {\n                        return GestureDetector(\n                            onTap: () => Navigator.of(context).pop(entry.key),\n                            child: Container(\n                                width: MediaQuery.of(context).size.width * 0.12,\n                                height: MediaQuery.of(context).size.width * 0.12,\n                                decoration: BoxDecoration(\n                                    borderRadius: BorderRadius.circular(MediaQuery.of(context).size.width * 0.06),\n                                    color: Color(entry.value['b']),\n                                ),\n                            ),\n                        );\n                    }).toList(),\n                ),\n            ),\n        );\n    }\n}\n`)),mdx(\"p\",null,\"As we already stored different colors in \",mdx(\"strong\",{parentName:\"p\"},\"NoteColors\"),\" Map object, we iterate this object and fill the color palette with bright colors.\"),mdx(\"p\",null,mdx(\"img\",e({parentName:\"p\"},{src:\"note-app-flutter/notes-app-color-palette.jpg\",alt:\"Color Palette:=:60\"}))),mdx(\"h3\",null,\"Save notes\"),mdx(\"p\",null,\"We have everything to save notes in the database. We save a note in the database if \",mdx(\"strong\",{parentName:\"p\"},\"backButton\"),\" is pressed at the top. Now add a function to handle \",mdx(\"strong\",{parentName:\"p\"},\"backButton\"),\" \",mdx(\"strong\",{parentName:\"p\"},\"onPressed\"),\".\"),mdx(\"pre\",null,mdx(\"code\",e({parentName:\"pre\"},{className:\"language-dart\"}),`void handleBackButton() async {\n    if (noteTitle.length == 0) {\n        // Go Back without saving\n        if (noteContent.length == 0) {\n            Navigator.pop(context);\n            return;\n        }\n        else {\n            String title = noteContent.split('\\\\n')[0];\n            if (title.length > 31) {\n                title = title.substring(0, 31);\n            }\n            setState(() {\n                noteTitle = title;\n            });\n        }\n    }\n\n    // Save New note\n    Note noteObj = Note(\n        title: noteTitle, \n        content: noteContent, \n        noteColor: noteColor\n    );\n    try {\n        await _insertNote(noteObj);\n    } catch (e) {\n        print('Error inserting row');\n    } finally {\n        Navigator.pop(context);\n        return;\n    }\n}\n`)),mdx(\"p\",null,\"This function calls \",mdx(\"strong\",{parentName:\"p\"},\"_insertNote()\"),\" which saves the note object in the database.\"),mdx(\"pre\",null,mdx(\"code\",e({parentName:\"pre\"},{className:\"language-dart\"}),`Future<void> _insertNote(Note note) async {\n  NotesDatabase notesDb = NotesDatabase();\n  await notesDb.initDatabase();\n  int result = await notesDb.insertNote(note);\n  await notesDb.closeDatabase();\n}\n`)),mdx(\"p\",null,\"We have saved notes in the database, now in the Home screen, display the saved notes in list view.\"),mdx(\"hr\",null),mdx(\"h2\",null,\"Show saved notes on the Home screen\"),mdx(\"p\",null,\"We can retrieve saved notes from the database and we use that retrieved data to show a note as a list on the Home screen. As retrieving data from the database is an async task and we need to have data before building the Home widget, we use \",mdx(\"a\",e({parentName:\"p\"},{href:\"https://api.flutter.dev/flutter/widgets/FutureBuilder-class.html\"}),\"FutureBuilder\"),\".\"),mdx(\"pre\",null,mdx(\"code\",e({parentName:\"pre\"},{className:\"language-dart\"}),`Future<List<Map<String, dynamic>>> readDatabase() async {\n    try {\n      NotesDatabase notesDb = NotesDatabase();\n      await notesDb.initDatabase();\n      List<Map> notesList = await notesDb.getAllNotes();\n      await notesDb.closeDatabase();\n      List<Map<String, dynamic>> notesData = List<Map<String, dynamic>>.from(notesList);\n        notesData.sort((a, b) => (a['title']).compareTo(b['title']));\n      return notesData;\n    } catch(e) {\n        print('Error retrieving notes');\n        return [{}];\n    }\n}\n`)),mdx(\"p\",null,\"This function reads all saved notes in the database and returns them as \",mdx(\"strong\",{parentName:\"p\"},\"Future\"),\" objects. We call this function in FutureBuilder and it builds the note list which displays each notes as a list.\"),mdx(\"p\",null,\"Before that add necessary imports in \",mdx(\"strong\",{parentName:\"p\"},\"home.dart\"),\" to handle the database, to store note object and colors.\"),mdx(\"pre\",null,mdx(\"code\",e({parentName:\"pre\"},{className:\"language-dart\"}),`import '../models/note.dart';\nimport '../models/notes_database.dart';\nimport '../theme/note_colors.dart';\n`)),mdx(\"p\",null,\"Store read notes from database in state and define other state variables\"),mdx(\"pre\",null,mdx(\"code\",e({parentName:\"pre\"},{className:\"language-dart\"}),`List<Map<String, dynamic>> notesData;\nList<int> selectedNoteIds = [];\n`)),mdx(\"p\",null,mdx(\"strong\",{parentName:\"p\"},\"notesData\"),\" stores all notes data read from database and \",mdx(\"strong\",{parentName:\"p\"},\"selectedNoteIds\"),\" will have a list of selected notes when a note is selected in Home.\"),mdx(\"pre\",null,mdx(\"code\",e({parentName:\"pre\"},{className:\"language-dart\"}),`body: FutureBuilder(\n    future: readDatabase(),\n    builder: (context, snapshot) {\n        if (snapshot.hasData) {\n            notesData = snapshot.data;\n            return Stack(\n                children: <Widget>[\n                    // Display Notes\n                    AllNoteLists(\n                        snapshot.data,\n                        this.selectedNoteIds,\n                        afterNavigatorPop,\n                        handleNoteListLongPress,\n                        handleNoteListTapAfterSelect,\n                    ),\n                ],\n            );\n        } else if (snapshot.hasError) {\n            print('Error reading database');\n        } else {\n            return Center(\n                child: CircularProgressIndicator(\n                    backgroundColor: Color(c3),\n                ),\n            );\n        }\n    }\n),\n`)),mdx(\"p\",null,\"Here before building the widget we read the data from the database and builds a list of note widgets to display on the Home screen by calling \",mdx(\"strong\",{parentName:\"p\"},\"AllNoteLists\"),\" widget. We also pass different callback functions to \",mdx(\"strong\",{parentName:\"p\"},\"AllNoteLists\"),\" to handles cases like the long selection of note, deselect a note, etc.\"),mdx(\"p\",null,\"Define all these functions inside \",mdx(\"strong\",{parentName:\"p\"},\"_Home\")),mdx(\"pre\",null,mdx(\"code\",e({parentName:\"pre\"},{className:\"language-dart\"}),`// Render the screen and update changes\nvoid afterNavigatorPop() {\n    setState(() {});\n}\n\n// Long Press handler to display bottom bar\nvoid handleNoteListLongPress(int id) {\n    setState(() {\n        if (selectedNoteIds.contains(id) == false) {\n            selectedNoteIds.add(id);\n        }\n    });\n}\n\n// Remove selection after long press\nvoid handleNoteListTapAfterSelect(int id) {\n    setState(() {\n        if (selectedNoteIds.contains(id) == true) {\n            selectedNoteIds.remove(id);\n        }\n    });\n}\n\n// Delete Note/Notes\nvoid handleDelete() async {\n    try {\n        NotesDatabase notesDb = NotesDatabase();\n        await notesDb.initDatabase();\n        for (int id in selectedNoteIds) {\n            int result = await notesDb.deleteNote(id);\n        }\n        await notesDb.closeDatabase();\n    } catch (e) {\n\n    } finally {\n        setState(() {\n            selectedNoteIds = [];\n        });\n    }\n}\n`)),mdx(\"p\",null,\"Define \",mdx(\"strong\",{parentName:\"p\"},\"AllNoteLists\"),\" widget which gets arguments from parent widget including note data and callback functions to handle\"),mdx(\"pre\",null,mdx(\"code\",e({parentName:\"pre\"},{className:\"language-dart\"}),`// Display all notes\nclass AllNoteLists extends StatelessWidget {\n    final data;\n    final selectedNoteIds;\n    final afterNavigatorPop;\n    final handleNoteListLongPress;\n    final handleNoteListTapAfterSelect;\n\n    AllNoteLists(\n        this.data, \n        this.selectedNoteIds,\n        this.afterNavigatorPop,\n        this.handleNoteListLongPress,\n        this.handleNoteListTapAfterSelect,\n    );\n\n    @override\n    Widget build(BuildContext context) {\n        return ListView.builder(\n            itemCount: data.length,\n            itemBuilder: (context, index) {\n                dynamic item = data[index];\n                return DisplayNotes(\n                    item,\n                    selectedNoteIds,\n                    (selectedNoteIds.contains(item['id']) == false? false: true),\n                    afterNavigatorPop, \n                    handleNoteListLongPress,\n                    handleNoteListTapAfterSelect,\n                );\n            }\n        );\n    }\n}\n\n\n// A Note view showing title, first line of note and color\nclass DisplayNotes extends StatelessWidget {\n    final notesData;\n    final selectedNoteIds;\n    final selectedNote;\n    final callAfterNavigatorPop;\n    final handleNoteListLongPress;\n    final handleNoteListTapAfterSelect;\n\n    DisplayNotes(\n        this.notesData,\n        this.selectedNoteIds,\n        this.selectedNote,\n        this.callAfterNavigatorPop,\n        this.handleNoteListLongPress,\n        this.handleNoteListTapAfterSelect,\n    );\n\n    @override\n    Widget build(BuildContext context) {\n        return Padding(\n            padding: const EdgeInsets.symmetric(horizontal: 8.0, vertical: 2.0),\n            child: Material(\n                elevation: 1,\n                color: (selectedNote == false? Color(c1): Color(c8)),\n                clipBehavior: Clip.hardEdge,\n                borderRadius: BorderRadius.circular(5.0),\n                child: InkWell(\n                    onTap: () {\n                        if (selectedNote == false) {\n                            if (selectedNoteIds.length == 0) {\n                                // Go to edit screen to update notes\n                            }\n                            else {\n                                handleNoteListLongPress(notesData['id']);\n                            }\n                        } \n                        else {\n                            handleNoteListTapAfterSelect(notesData['id']);\n                        }\n                    },\n\n                    onLongPress: () {\n                        handleNoteListLongPress(notesData['id']);\n                    },\n                    child: Container(\n                        width: MediaQuery.of(context).size.width,\n                        padding: const EdgeInsets.symmetric(horizontal: 8.0, vertical: 8.0),\n                        child: Row(\n                            children: <Widget>[\n                                Expanded(\n                                    flex: 1,\n                                    child: Column(\n                                        mainAxisAlignment: MainAxisAlignment.center,\n                                        crossAxisAlignment: CrossAxisAlignment.center,\n                                        mainAxisSize: MainAxisSize.min,\n                                        children: <Widget>[\n                                            Container(\n                                                alignment: Alignment.center,\n                                                decoration: BoxDecoration(\n                                                    color: (selectedNote == false? \n                                                        Color(NoteColors[notesData['noteColor']]['b']):\n                                                        Color(c9)\n                                                    ),\n                                                    shape: BoxShape.circle,\n                                                ),\n                                                child: Padding(\n                                                    padding: EdgeInsets.all(10),\n                                                    child: (\n                                                        selectedNote == false?\n                                                        Text(\n                                                            notesData['title'][0],\n                                                            style: TextStyle(\n                                                                color: Color(c1),\n                                                                fontSize: 21,\n                                                            ),\n                                                        ):\n                                                        Icon(\n                                                            Icons.check,\n                                                            color: Color(c1),\n                                                            size: 21,\n                                                        )\n                                                    ),\n                                                ),\n                                            ),\n                                        ],\n                                    ),\n                                ),\n\n                                Expanded(\n                                    flex: 5,\n                                    child: Column(\n                                        mainAxisAlignment: MainAxisAlignment.spaceAround,\n                                        crossAxisAlignment: CrossAxisAlignment.start,\n                                        mainAxisSize: MainAxisSize.min,\n                                        children:<Widget>[\n                                            Text(\n                                                notesData['title'] != null? notesData['title']: \"\",\n                                                style: TextStyle(\n                                                    color: Color(c3),\n                                                    fontSize: 18,\n                                                    fontWeight: FontWeight.bold,\n                                                ),\n                                            ),\n\n                                            Container(\n                                                height: 3,\n                                            ),\n\n                                            Text(\n                                                notesData['content'] != null? notesData['content'].split('\\\\n')[0]: \"\",\n                                                style: TextStyle(\n                                                    color: Color(c7),\n                                                    fontSize: 16,\n                                                    fontWeight: FontWeight.w300,\n                                                ),\n                                            ),\n                                        ],\n                                    ),\n                                ),\n                            ],\n                        ),\n                    ),\n                ),\n            ),\n        );\n    }\n}\n`)),mdx(\"p\",null,mdx(\"strong\",{parentName:\"p\"},\"AllNoteLists\"),\" builds a list of notes from the Map of a list of notes. In \",mdx(\"strong\",{parentName:\"p\"},\"ListView\"),\" builder it passes each note extracted data to another widget \",mdx(\"strong\",{parentName:\"p\"},\"DisplayNotes\"),\" which represents each note. \"),mdx(\"p\",null,\"Now Home screen displays all notes stored as\"),mdx(\"p\",null,mdx(\"img\",e({parentName:\"p\"},{src:\"note-app-flutter/notes-app-home-notes-list.jpg\",alt:\"Home screen:=:30\"}))),mdx(\"p\",null,\"Long press on the note to select the note. And if a note is selected we can add a delete action to delete the selected notes. Add \",mdx(\"strong\",{parentName:\"p\"},\"Delete\"),\" button at \",mdx(\"strong\",{parentName:\"p\"},\"appBar\"),\" \",mdx(\"strong\",{parentName:\"p\"},\"actions\"),\" which shows delete icon only if any note is selected.\"),mdx(\"pre\",null,mdx(\"code\",e({parentName:\"pre\"},{className:\"language-dart\"}),`actions: [\n    (selectedNoteIds.length > 0?\n        IconButton(\n            icon: const Icon(\n                Icons.delete,\n                color: const Color(c1),\n            ),\n            tooltip: 'Delete',\n            onPressed: () => handleDelete(),\n        ):\n        Container()\n    ),\n],\n`)),mdx(\"p\",null,\"Define \",mdx(\"strong\",{parentName:\"p\"},\"hanldeDelete()\"),\" which deletes all selected notes from database.\"),mdx(\"pre\",null,mdx(\"code\",e({parentName:\"pre\"},{className:\"language-dart\"}),`// Delete Notes\nvoid handleDelete() async {\n    try {\n        NotesDatabase notesDb = NotesDatabase();\n        await notesDb.initDatabase();\n        for (int id in selectedNoteIds) {\n            int result = await notesDb.deleteNote(id);\n        }\n        await notesDb.closeDatabase();\n    } catch (e) {\n        print('Cannot delete notes');\n    } finally {\n        setState(() {\n            selectedNoteIds = [];\n        });\n    }\n}\n`)),mdx(\"p\",null,\"For notes, we have added create, read and delete functions. Now we will add an update function to edit already stored notes.\"),mdx(\"h3\",null,\"Update notes\"),mdx(\"p\",null,\"For this, we can use the Edit screen to update the notes as it has all features to create notes which are similar for update notes also. We have to tell the Edit screen which type of notes operations we doing either create or update notes. To inform the Edit screen we can pass arguments to \",mdx(\"strong\",{parentName:\"p\"},\"NotesEdit\"),\" widget while routing about the type of action and notes data if the action is to update. Change \",mdx(\"strong\",{parentName:\"p\"},\"NotesEdit\"),\" widget to accept arguments telling the type of action and necessary data.\"),mdx(\"pre\",null,mdx(\"code\",e({parentName:\"pre\"},{className:\"language-dart\"}),`class NotesEdit extends StatefulWidget {\n    final args;\n\n    const NotesEdit(this.args);\n    _NotesEdit createState() => _NotesEdit();\n}\n`)),mdx(\"p\",null,mdx(\"strong\",{parentName:\"p\"},\"args\"),\" stores parameters passed from parent widget.\"),mdx(\"p\",null,\"Change navigation arguments for \",mdx(\"strong\",{parentName:\"p\"},\"NotesEdit\"),\" in the floating-action-button in \",mdx(\"strong\",{parentName:\"p\"},\"_Home\"),\".\"),mdx(\"pre\",null,mdx(\"code\",e({parentName:\"pre\"},{className:\"language-dart\"}),`//Floating Button\nfloatingActionButton: FloatingActionButton(\n    child: const Icon(\n        Icons.add,\n        color: const Color(c5),\n    ),\n    tooltip: 'New Notes',\n    backgroundColor: const Color(c4),\n    onPressed: () {\n      Navigator.push(\n        context,     \n        MaterialPageRoute(builder: (context) => NotesEdit(['new', {}])),\n      );\n    }\n),\n`)),mdx(\"p\",null,\"As floating-button triggers the creation of a new note, we pass argument \",mdx(\"strong\",{parentName:\"p\"},\"new\"),\" to inform \",mdx(\"strong\",{parentName:\"p\"},\"NotesEdit\"),\" that operation in creation of note.\"),mdx(\"p\",null,\"When tapped on a note on the Home screen we navigate to the Edit screen to update the note. For this add navigation from Home to Edit when tapped on the note in \",mdx(\"strong\",{parentName:\"p\"},\"DisplayNotes\"),\".\"),mdx(\"pre\",null,mdx(\"code\",e({parentName:\"pre\"},{className:\"language-dart\"}),`child: InkWell(\nonTap: () {\n    if (selectedNote == false) {\n        if (selectedNoteIds.length == 0) {\n            Navigator.push(\n                context, \n        MaterialPageRoute(\n          builder: (context) => NotesEdit(['update', notesData]),\n        ),\n            ).then((dynamic value) {\n                    callAfterNavigatorPop();\n                }\n            );\n            return;     \n        }\n        else {\n            handleNoteListLongPress(notesData['id']);\n        }\n    } \n    else {\n        handleNoteListTapAfterSelect(notesData['id']);\n    }\n},\n`)),mdx(\"p\",null,\"We pass \",mdx(\"strong\",{parentName:\"p\"},\"update\"),\" and \",mdx(\"strong\",{parentName:\"p\"},\"notesData\"),\" to the Edit screen stating the operation is updating notes and note data to fill in the Edit screen.\"),mdx(\"p\",null,\"Change \",mdx(\"strong\",{parentName:\"p\"},\"NotesEdit\"),\" widget in \",mdx(\"strong\",{parentName:\"p\"},\"notes_edit.dart\"),\" for handling update note operation.\"),mdx(\"pre\",null,mdx(\"code\",e({parentName:\"pre\"},{className:\"language-dart\"}),`@override\nvoid initState() {\n    super.initState();\n    noteTitle = (widget.args[0] == 'new'? '': widget.args[1]['title']);\n    noteContent = (widget.args[0] == 'new'? '': widget.args[1]['content']);\n    noteColor = (widget.args[0] == 'new'? 'red': widget.args[1]['noteColor']);\n\n    _titleTextController.text = (widget.args[0] == 'new'? '': widget.args[1]['title']);\n    _contentTextController.text = (widget.args[0] == 'new'? '': widget.args[1]['content']);\n    _titleTextController.addListener(handleTitleTextChange);\n    _contentTextController.addListener(handleNoteTextChange);\n}\n\nvoid handleBackButton() async {\n    if (noteTitle.length == 0) {\n        // Go Back without saving\n        if (noteContent.length == 0) {\n            Navigator.pop(context);\n            return;\n        }\n        else {\n            String title = noteContent.split('\\\\n')[0];\n            if (title.length > 31) {\n                title = title.substring(0, 31);\n            }\n            setState(() {\n                noteTitle = title;\n            });\n        }\n    }\n\n    // Save New note\n    if (widget.args[0] == 'new') {\n        Note noteObj = Note(\n            title: noteTitle, \n            content: noteContent, \n            noteColor: noteColor\n        );\n        try {\n            await _insertNote(noteObj);\n        } catch (e) {\n\n        } finally {\n            Navigator.pop(context);\n            return;\n        }\n    }\n    \n    // Update Note\n    else if (widget.args[0] == 'update') {\n        Note noteObj = Note(\n            id: widget.args[1]['id'],\n            title: noteTitle, \n            content: noteContent, \n            noteColor: noteColor\n        );\n        try {\n            await _updateNote(noteObj);\n        } catch (e) {\n\n        } finally {\n            Navigator.pop(context);\n            return;\n        }\n    }\n}\n`)),mdx(\"p\",null,\"Tapping on the note in the Home screen will take us to the Edit screen to update notes.\"),mdx(\"hr\",null),mdx(\"p\",null,\"This tutorial addressed how to create a simple note-taking app in Flutter with common operations like create, read, update and delete. We can extend the app to have multiple day-to-day useful features. I hope you will do that to create your own notes app according to your interests and needs.\"),mdx(\"p\",null,\"I have created a full Android working application with additional features like Notes sharing, multi-select notes, deleting notes in the edit screen, sort text in notes, etc. Check out the full code at \",mdx(\"a\",e({parentName:\"p\"},{href:\"https://github.com/santhalakshminarayana/zehero-note\"}),\"github.com/santhalakshminarayana/zehero-note\"),\".\"))}MDXContent.isMDXComponent=!0;\n","scope":{}},"id":"create-a-notes-app-with-flutter"},"__N_SSG":true}