{"pageProps":{"postMetadata":{"title":"Super fast Python (Part-3): Multi-processing","description":"Make computations in Python faster with Multi-processing .","imgName":"super-fast-python-multi-processing/super-fast-python-multi-processing.jpg","date":"Nov 12, 2022","tags":["python-performance","python"],"keywords":["python-multiprocessing","python-performance","python-optimize","python","fast-python","speed"],"id":"super-fast-python-multi-processing"},"postContent":{"compiledSource":"var c=Object.defineProperty,m=Object.defineProperties;var u=Object.getOwnPropertyDescriptors;var n=Object.getOwnPropertySymbols;var o=Object.prototype.hasOwnProperty,i=Object.prototype.propertyIsEnumerable;var p=(a,t,r)=>t in a?c(a,t,{enumerable:!0,configurable:!0,writable:!0,value:r}):a[t]=r,e=(a,t)=>{for(var r in t||(t={}))o.call(t,r)&&p(a,r,t[r]);if(n)for(var r of n(t))i.call(t,r)&&p(a,r,t[r]);return a},l=(a,t)=>m(a,u(t));var h=(a,t)=>{var r={};for(var s in a)o.call(a,s)&&t.indexOf(s)<0&&(r[s]=a[s]);if(a!=null&&n)for(var s of n(a))t.indexOf(s)<0&&i.call(a,s)&&(r[s]=a[s]);return r};const layoutProps={},MDXLayout=\"wrapper\";function MDXContent(r){var s=r,{components:a}=s,t=h(s,[\"components\"]);return mdx(MDXLayout,l(e(e({},layoutProps),t),{components:a,mdxType:\"MDXLayout\"}),mdx(\"p\",null,mdx(\"img\",e({parentName:\"p\"},{src:\"super-fast-python-multi-processing/super-fast-python-multi-processing.jpg\",alt:\"Super fast Python: Multi-processing\"}))),mdx(\"h6\",null,\"Published on: \",mdx(\"strong\",{parentName:\"h6\"},\"Nov 12, 2022\")),mdx(\"h1\",null,\"Super fast Python (Part-3): Multi-processing\"),mdx(\"p\",null,\"This is the third post in the series on Python performance and Optimization. The series points out the utilization of inbuilt libraries, low-level code conversions, and other Python implementations to speed-up Python. The other posts included in this series are \"),mdx(\"ul\",null,mdx(\"li\",{parentName:\"ul\"},\"(Part-1): \",mdx(\"a\",e({parentName:\"li\"},{href:\"https://santhalakshminarayana.github.io/blog/super-fast-python-why-python-slow\"}),\"Why Python is slow?\")),mdx(\"li\",{parentName:\"ul\"},\"(Part-2): \",mdx(\"a\",e({parentName:\"li\"},{href:\"https://santhalakshminarayana.github.io/blog/super-fast-python-good-practices\"}),\"Good practices to write fast Python code\")),mdx(\"li\",{parentName:\"ul\"},\"(Part-3): Multi-processing in Python (this post)\"),mdx(\"li\",{parentName:\"ul\"},\"(Part-4): \",mdx(\"a\",e({parentName:\"li\"},{href:\"https://santhalakshminarayana.github.io/blog/super-fast-python-cython\"}),\"Use Cython to get speed as fast as C\")),mdx(\"li\",{parentName:\"ul\"},\"(Part-5): \",mdx(\"a\",e({parentName:\"li\"},{href:\"https://santhalakshminarayana.github.io/blog/super-fast-python-numba\"}),\"Use Numba to speed up Python Functions and Numeric calculations\"))),mdx(\"h2\",null,\"Problems with GIL\"),mdx(\"p\",null,\"In the previous post on \",mdx(\"a\",e({parentName:\"p\"},{href:\"https://santhalakshminarayana.github.io/blog/super-fast-python-why-python-slow\"}),\"why python is slow?\"),\", we discussed that the problems with \",mdx(\"a\",e({parentName:\"p\"},{href:\"https://santhalakshminarayana.github.io/blog/super-fast-python-why-python-slow#gil-good-and-bad\"}),\"Global Interpreter Lock (GIL) in Python\"),\". \",mdx(\"a\",e({parentName:\"p\"},{href:\"https://realpython.com/python-gil/\"}),\"GIL\"),\" is part of Python's design that ensures thread-safe in Python. But, GIL only allows the interpreter to run with only one thread which makes multi-threading hard and slow in Python.\"),mdx(\"p\",null,\"This makes multi-threading confined to use in cases like where \",mdx(\"a\",e({parentName:\"p\"},{href:\"https://tenthousandmeters.com/blog/python-behind-the-scenes-13-the-gil-and-its-effects-on-python-multithreading/\"}),\"system releases the GIL\"),\" for tasks where it waits for external processes to complete and return result/status like I/O operations, network requests, etc. To achieve better concurrency in Python, use \",mdx(\"a\",e({parentName:\"p\"},{href:\"https://docs.python.org/3/library/asyncio-task.html\"}),\"coroutines with asyncio\"),\".\"),mdx(\"p\",null,\"So, even if the system has multiple cores and supports 1000s of threads, multi-threading is not suitable for CPU-intensive tasks. But, how to do \",mdx(\"a\",e({parentName:\"p\"},{href:\"https://hpc.llnl.gov/documentation/tutorials/introduction-parallel-computing-tutorial\"}),\"parallel computing\"),\" in Python? The answer is Multi-programming. Multi-programming creates multiple sub-processes (maximum processes can be created = no.of cores) where each process will have its interpreter with GIL and independent memory space. In processes, GIL won't be a problem because each one will have its interpreter to run the bytecode and the CPython manages multiple sub-processes. But, there are some overheads with processes like spawning/forking a process with its own memory space is slower than creating a thread and each process is separate which makes inter-process communication slow.\"),mdx(\"p\",null,\"Also, there are external libraries like Numpy that release GIL and compute the tasks faster. \",mdx(\"a\",e({parentName:\"p\"},{href:\"https://iotespresso.com/numpy-releases-gil-what-does-that-mean/\"}),\"Numpy releases GIL\"),\" - means most of the Numpy computations are executed in C-libraries that don't require an interpreter which makes Numpy can release the GIL for that particular C-library.\"),mdx(\"hr\",null),mdx(\"p\",null,mdx(\"a\",e({parentName:\"p\"},{href:\"https://docs.python.org/3/library/multiprocessing.html\"}),\"multiprocessing\"),\" module in Python offers a variety of APIs for achieving multiprocessing. In this blog, we discuss \",mdx(\"a\",e({parentName:\"p\"},{href:\"https://docs.python.org/3/library/multiprocessing.html#multiprocessing.pool.Pool\"}),\"mulitprocessing.Pool\"),\" class that takes multiple numbers of tasks and executes them parallelly by distributing tasks among multiple cores/workers.\"),mdx(\"blockquote\",null,mdx(\"p\",{parentName:\"blockquote\"},mdx(\"a\",e({parentName:\"p\"},{href:\"https://docs.python.org/3/library/concurrent.futures.html#concurrent.futures.ProcessPoolExecutor\"}),\"concurrent.futures.ProcessPoolExecutor\"),\" provides a higher level interface on top of \",mdx(\"strong\",{parentName:\"p\"},\"multiprocessing\"),\" and offers additonal functions to  control the process pool.\")),mdx(\"h2\",null,\"Multiprocessing Pool\"),mdx(\"h3\",null,\"Why and what is a pool?\"),mdx(\"p\",null,\"Imagine we have an 8-cores CPU and create a process by allocating each process to each core for every task and executing them parallelly. If no.of tasks is <= no.of cores, then the parallel computing works smoothly. If we increase the no.of tasks to let's say 100 and create a process for each task and then execute them parallelly, the system has to manage the lifecycle of each process and ensure that processes don't hang up or reach a deadlock state. If we have numerous processes that the system can't handle we run into problems like system crash or hang.\"),mdx(\"p\",null,\"A pool is like a strategy in parallel computing to make sure that only a certain number of workers (or cores in the CPU) are allocated to run tasks given in any number. A pool is really helpful to prevent the system from the crash while serving a very huge number of processes that may overkill the CPU if not properly managed. We create a maximum of n-workers for a system with n-cores and distribute the task to every worker to run parallelly. The main difference is that in normal execution, for every task we create a separate process, but in pool processing, first, we create a pool of processes, then distribute the tasks among the processes in the pool.\"),mdx(\"p\",null,\"If we have 100 tasks and a pool with 5 processes, distribute the 100 tasks to the process pool by running a batch of 20 tasks per process.\"),mdx(\"p\",null,\"Consider a function that takes around \",mdx(\"strong\",{parentName:\"p\"},\"1-second\"),\" to complete. And we have to call the function for 10 different input parameters.\"),mdx(\"p\",null,\"The following example shows \",mdx(\"strong\",{parentName:\"p\"},\"fun_1()\"),\" as a function that takes a parameter \",mdx(\"strong\",{parentName:\"p\"},\"a\"),\", sleeps for 1 second, and then returns the square of \",mdx(\"strong\",{parentName:\"p\"},\"a\"),\".\"),mdx(\"blockquote\",null,mdx(\"p\",{parentName:\"blockquote\"},\"Why prefer \",mdx(\"a\",e({parentName:\"p\"},{href:\"https://peps.python.org/pep-0418/\"}),\"time.perf_counter()\"),\" over time.time()? time.time() is not monotonic - which means that the system can change the clock time with synchronization to the internet or other update. Where time.perf_counter() is system-wide and the reference point is unknown so only the results between consecutive calls are considered.\")),mdx(\"p\",null,\"Now, call the function 10 times by passing the elements in the range(0..10). If we call the function without parallel processing, the total time will be around 10 seconds because every function call takes 1 second, and for 10 function calls it will be around 10 seconds.\"),mdx(\"pre\",null,mdx(\"code\",e({parentName:\"pre\"},{className:\"language-python\"}),`from os import getpid\nfrom time import perf_counter, sleep\nfrom multiprocessing import Pool, cpu_count\n\n# function that sleeps for 1 second\ndef fun_1(a):\n    print('WORKER ID:', getpid())\n    sleep(1)\n    return a * a\n\n# call fun_1 for elements in range(0..10)\n\n# without multiprocessing\natime = perf_counter()\nprint('without multiprocessing')\n\nres = [fun_1(i) for i in range(10)]\n\nprint(f\"time taken without multiprocessing: {perf_counter()-atime}\\\\n\")\n\n# with multiprocessing\natime = perf_counter()\nprint('with multiprocessing')\n\nwith Pool(processes=cpu_count()) as pool:\n    res = pool.map(fun_1, range(10))\n\nprint(f\"time taken with multiprocessing: {perf_counter()-atime}\")\n`)),mdx(\"pre\",null,mdx(\"code\",e({parentName:\"pre\"},{className:\"language-markdown:output\"}),`without multiprocessing\nWORKER ID: 32093\nWORKER ID: 32093\nWORKER ID: 32093\nWORKER ID: 32093\nWORKER ID: 32093\nWORKER ID: 32093\nWORKER ID: 32093\nWORKER ID: 32093\nWORKER ID: 32093\nWORKER ID: 32093\ntime taken without multiprocessing: 10.019481873001496\n\nwith multiprocessing\nWORKER ID: 33097\nWORKER ID: 33099\nWORKER ID: 33098\nWORKER ID: 33100\nWORKER ID: 33101\nWORKER ID: 33103\nWORKER ID: 33102\nWORKER ID: 33096\nWORKER ID: 33098\nWORKER ID: 33101\ntime taken with multiprocessing: 2.077159455002402\n`)),mdx(\"p\",null,\"In the above code, we applied parallel computing by passing tasks (calling \",mdx(\"strong\",{parentName:\"p\"},\"fun_()\"),\") to the multiprocessing pool. \"),mdx(\"p\",null,\"The pool class constructor takes the following arguments and returns the pool object\"),mdx(\"ul\",null,mdx(\"li\",{parentName:\"ul\"},mdx(\"strong\",{parentName:\"li\"},\"processes\"),\": no.of workers, default is all cores available in the system. We can check the available cores by calling \",mdx(\"em\",{parentName:\"li\"},\"multiprocessing.cpu_count()\"),\" (mine is 8)\"),mdx(\"li\",{parentName:\"ul\"},mdx(\"strong\",{parentName:\"li\"},\"initializer\"),\": initializer function that will be called by every worker when it starts\"),mdx(\"li\",{parentName:\"ul\"},mdx(\"strong\",{parentName:\"li\"},\"initargs\"),\": arguments to the initializer function above\"),mdx(\"li\",{parentName:\"ul\"},mdx(\"strong\",{parentName:\"li\"},\"maxtasksperchild\"),\": max. no.of tasks a worker should execute before being replaced by another worker process. This behavior releases the workers that are using system resources for a very long time\")),mdx(\"p\",null,\"We discuss \",mdx(\"strong\",{parentName:\"p\"},\"initializer\"),\" and \",mdx(\"strong\",{parentName:\"p\"},\"initargs\"),\" in the later section on sharing data between processes.\"),mdx(\"p\",null,\"The pool object has several methods like apply, map, starmap, imap, etc, that serves different purpose for applying parallel computing. In the above snippet, we used Pool.map() function (same as normal map()) that takes a function and an iterable and calls the function by passing each element in the iterable as an argument. The function should accept only an argument. The Pool.map() is a blocking call and it distributes the tasks among the available cores by dividing the tasks into chunks.\"),mdx(\"p\",null,\"Pool.map() takes the following arguments\"),mdx(\"ul\",null,mdx(\"li\",{parentName:\"ul\"},mdx(\"strong\",{parentName:\"li\"},\"func\"),\": the function to be executed parallelly that takes one argument\"),mdx(\"li\",{parentName:\"ul\"},mdx(\"strong\",{parentName:\"li\"},\"iterable\"),\": an iterable whose elements are passed as arguments to the function above \"),mdx(\"li\",{parentName:\"ul\"},mdx(\"strong\",{parentName:\"li\"},\"chunksize\"),\": chunk size number that used to divide the tasks\")),mdx(\"blockquote\",null,mdx(\"p\",{parentName:\"blockquote\"},\"based on the nature of tasks, different \",mdx(\"strong\",{parentName:\"p\"},\"chunksize\"),\" numbers \",mdx(\"a\",e({parentName:\"p\"},{href:\"https://stackoverflow.com/questions/53751050/multiprocessing-understanding-logic-behind-chunksize\"}),\"schedules tasks differently\"))),mdx(\"blockquote\",null,mdx(\"p\",{parentName:\"blockquote\"},\"In UNIX and such systems, \",mdx(\"a\",e({parentName:\"p\"},{href:\"https://docs.python.org/3/library/multiprocessing.html#contexts-and-start-methods\"}),\"multiprocessing creates processes\"),\" using a fork, and in windows, it starts processes using spawn. There are some \",mdx(\"a\",e({parentName:\"p\"},{href:\"https://docs.python.org/3/library/multiprocessing.html#contexts-and-start-methods\"}),\"additional restrictions\"),\" one should be aware of when the process start method is other than fork like protecting the entry point of the program by creating processes inside \",mdx(\"em\",{parentName:\"p\"},\"if \",\"_\",\"_\",\"name\",\"_\",\"_\",\"==\",\"_\",\"_\",\"main\",\"_\",\"_\"),\" because spawn creates new python interpreter for each process.\")),mdx(\"p\",null,\"As we have 8 cores available and 10 tasks at hand, Pool.map() distributes the tasks among the 8 workers by dividing tasks into chunks like \",\"[2, 2, 1, 1, 1, 1, 1, 1]\",\" and pass them to workers.\"),mdx(\"p\",null,\"The total time taken with multiprocessing is 2 seconds which is 5x times faster than without multiprocessing (10 seconds).\"),mdx(\"blockquote\",null,mdx(\"p\",{parentName:\"blockquote\"},\"for large iterable size use Pool.imap() with chunksize for better efficiency\")),mdx(\"blockquote\",null,mdx(\"p\",{parentName:\"blockquote\"},\"for multiple parameters function, use Pool.starmap() or Pool.map() with partial functions\")),mdx(\"h3\",null,\"Process vs Pool\"),mdx(\"p\",null,\"Use process, when there is a small number of tasks and each task takes a large amount of time. Use a pool, when there is a large number of tasks and each task takes a small amount of time.\"),mdx(\"hr\",null),mdx(\"h2\",null,\"Sharing data between processes\"),mdx(\"blockquote\",null,mdx(\"p\",{parentName:\"blockquote\"},\"It is strongly recommended to not share data between processes\")),mdx(\"h3\",null,\"Share data with global variables (copy-on-write)\"),mdx(\"p\",null,\"Processes created using multiprocessing run independently with their own memory space and they don't have access to the parent process's local data but they \",mdx(\"a\",e({parentName:\"p\"},{href:\"https://superfastpython.com/multiprocessing-inherit-global-variables-in-python/\"}),\"inherit the global data of the parent\"),\" (only when fork start method used). \"),mdx(\"p\",null,\"Since child processes get a snapshot of the parent process's global data, we can utilize this behavior in a way such that we can make sharable data available to child processes by making the data global.\"),mdx(\"p\",null,\"For the following example, we will share an integer value \",mdx(\"strong\",{parentName:\"p\"},\"x\"),\" and an array of integers \",mdx(\"strong\",{parentName:\"p\"},\"a\"),\" to calculate the sum of the product of each element in \",mdx(\"strong\",{parentName:\"p\"},\"a\"),\" with an element in the list of numbers from 0..n, n = 100000. And then compute the product of \",mdx(\"strong\",{parentName:\"p\"},\"x\"),\" and the whole sum.\"),mdx(\"pre\",null,mdx(\"code\",e({parentName:\"pre\"},{className:\"language-python\"}),`# function to be applied for each element\ndef sum_product(e):\n    w_sum = sum([x*i for i in a])\n    return w_sum * e\n\n# pool initializer function\ndef pool_initializer(X, A):\n    global x\n    x = X\n    global a\n    a = A\n\nn = 100000\nX = 3\nA = [2, 4, 6, 8, 10, 12]\n\nwith Pool(processes=cpu_count(), initializer=pool_initializer, initargs=(X, A)) as pool:\n    res = pool.map(sum_product, range(n))\n`)),mdx(\"p\",null,\"In the above snippet, we initialized the pool with the \",mdx(\"em\",{parentName:\"p\"},\"pool_initializer\"),\" function, this function will be called for every worker after they start and any data globalized inside this initialization function is available to all child processes. \"),mdx(\"blockquote\",null,mdx(\"p\",{parentName:\"blockquote\"},\"Even though we don't need the initializer function here to share data as we can make data global at the top level and all child processes would get a snapshot of the global data, there are other cases where the initializer function is useful. Like reading a file and sharing data, making a database connection, etc, which might work on variable parameters that we can pass in pool \",mdx(\"strong\",{parentName:\"p\"},\"initargs\"),\".\")),mdx(\"p\",null,\"Sharing data by leveraging global variables and copy-on-write data is only useful for read-only data. If any child process changes the global variable value, they don't reflect in the parent process.\"),mdx(\"pre\",null,mdx(\"code\",e({parentName:\"pre\"},{className:\"language-python\"}),`from random import randint\n\ndef random_increment(i):\n    rand_n = randint(0, i)\n    a[rand_n] += 1\n    print(f'child {i}: {a}')\n    \nn = 10\na = list(range(n))\n\nwith Pool(processes=cpu_count()) as pool:\n    pool.map(random_increment, range(n))\n\nprint(f'parent {a}')\n`)),mdx(\"p\",null,\"In the above program, we have initialized a global variable \",mdx(\"strong\",{parentName:\"p\"},\"a\"),\" which is a list. We applied the function \",mdx(\"em\",{parentName:\"p\"},\"random_increment()\"),\" for \",mdx(\"strong\",{parentName:\"p\"},\"n\"),\" tasks, and, \",mdx(\"em\",{parentName:\"p\"},\"random_increment()\"),\" function takes the number \",mdx(\"strong\",{parentName:\"p\"},\"i\"),\" and increments the list \",mdx(\"strong\",{parentName:\"p\"},\"a\"),\" at the index generated randomly in the range(0..i).\"),mdx(\"p\",null,\"As \",mdx(\"strong\",{parentName:\"p\"},\"a\"),\" is global, we expect the list \",mdx(\"strong\",{parentName:\"p\"},\"a\"),\" change in the parent process too, but it is not true as each child process is created by copying a snapshot of the parent data and each child will have their own memory.\"),mdx(\"p\",null,\"Look at the output of the above program below to check that, in the parent process, the value of \",mdx(\"strong\",{parentName:\"p\"},\"a\"),\" has not changed.\"),mdx(\"pre\",null,mdx(\"code\",e({parentName:\"pre\"},{className:\"language-markdown:Output\"}),`child 2: [1, 1, 2, 3, 4, 5, 6, 7, 8, 9]\nchild 1: [1, 1, 2, 3, 4, 5, 6, 7, 8, 9]\nchild 3: [0, 2, 2, 3, 4, 5, 6, 7, 8, 9]\nchild 8: [1, 1, 3, 3, 4, 5, 6, 7, 8, 9]\nchild 7: [1, 1, 2, 3, 4, 5, 6, 7, 8, 9]\nchild 6: [0, 1, 2, 3, 5, 5, 6, 7, 8, 9]\nchild 0: [1, 1, 2, 3, 4, 5, 6, 7, 8, 9]\nchild 4: [0, 2, 2, 3, 4, 5, 6, 7, 8, 9]\nchild 9: [1, 2, 2, 3, 4, 5, 6, 7, 8, 9]\nchild 5: [0, 1, 2, 4, 4, 5, 6, 7, 8, 9]\nparent [0, 1, 2, 3, 4, 5, 6, 7, 8, 9]\n`)),mdx(\"p\",null,\"This is because, the data sharing happens here by following a mechanism called \",mdx(\"strong\",{parentName:\"p\"},\"copy-on-write\"),\" where the OS instead of copying and creating the new memory for the global data, just facilitates access to the parent processes memory as long as the child process doesn't change the data. As we have seen in the above example, when the child process tries to change the data, OS just allocates the new memory by copying the shared data and then writes the changes to it. So, the child's process data changes are not reflected in the parent's process because both memory locations are different. This mechanism is vice-versa means that, after forking, when the data in the parent's process changes, they are not reflected in the child's process.\"),mdx(\"h3\",null,\"Share data using shared memory\"),mdx(\"p\",null,\"To avoid the problems like above, \",mdx(\"strong\",{parentName:\"p\"},\"multiprocessing\"),\" provides a mechanism to share data. To share the data between child processes, one must use sockets or shared files. But, to share simple values or arrays, multiprocessing provides a mechanism called \",mdx(\"strong\",{parentName:\"p\"},\"shared ctypes\"),\" to share data safely between processes.\"),mdx(\"p\",null,\"With \",mdx(\"a\",e({parentName:\"p\"},{href:\"https://docs.python.org/3/library/multiprocessing.html#module-multiprocessing.sharedctypes\"}),\"multiprocessing.sharedctypes\"),\", we can allocate the \",mdx(\"strong\",{parentName:\"p\"},\"ctypes\"),\" object from the shared memory and then the child processes can inherit them. \",mdx(\"a\",e({parentName:\"p\"},{href:\"https://docs.python.org/3/library/ctypes.html#fundamental-data-types\"}),\"cytpes\"),\" are nothing but primitive \",mdx(\"strong\",{parentName:\"p\"},\"C\"),\" compatible data types and \",mdx(\"strong\",{parentName:\"p\"},\"ctypes\"),\" module provides a wrapper around these data types to use in Python. The shared memory here is nothing but the underlying memory buffer and we will discuss later how can utilize this fact to share large Numpy arrays.\"),mdx(\"p\",null,\"Multiprocessing provides two types of shared ctypes, one for read-and-write values and arrays, and the other one for read-only values and arrays.\"),mdx(\"p\",null,\"To manipulate data in child processes, use \"),mdx(\"ul\",null,mdx(\"li\",{parentName:\"ul\"},mdx(\"strong\",{parentName:\"li\"},\"multiprocessing.Value\"),\": to share only single value variables such as numbers or strings\"),mdx(\"li\",{parentName:\"ul\"},mdx(\"strong\",{parentName:\"li\"},\"multiprocessing.Array\"),\": to share an array of values of the same data type in \",mdx(\"strong\",{parentName:\"li\"},\"C\"))),mdx(\"p\",null,\"To share read-only data, use\"),mdx(\"ul\",null,mdx(\"li\",{parentName:\"ul\"},mdx(\"strong\",{parentName:\"li\"},\"multiprocessing.RawValue\"),\": to share only single value variables\"),mdx(\"li\",{parentName:\"ul\"},mdx(\"strong\",{parentName:\"li\"},\"multiprocessing.RawArray\"),\": to share array of values\")),mdx(\"p\",null,\"The main difference between raw type and normal type is that the latter provides an automatic synchronization mechanism with locks to provide process-safe data sharing.\"),mdx(\"pre\",null,mdx(\"code\",e({parentName:\"pre\"},{className:\"language-python\"}),`from multiprocessing import Array\n\ndef random_increment(i):\n    rand_n = randint(0, i)\n    a[rand_n] += 1\n\n    print(f'child {i}: {list(a)}')\n    \ndef initializer_func(A):\n    global a\n    a = A\n\nn = 10\nA = Array('i', range(n))\n\nwith Pool(processes=cpu_count(), initializer=initializer_func, initargs=(A,)) as pool:\n    pool.map(random_increment, range(n))\n\nprint(f'parent: {list(A)}')\n`)),mdx(\"p\",null,\"In the above code, we have passed \",mdx(\"strong\",{parentName:\"p\"},\"multiprocessing.Array\"),\" instead of the normal list. \",mdx(\"strong\",{parentName:\"p\"},\"Array\"),\" is initialized with the data type ('i') and the iterable. We can also initialize the \",mdx(\"strong\",{parentName:\"p\"},\"Array\"),\" in other ways like defining the size first and assign later.  \"),mdx(\"pre\",null,mdx(\"code\",e({parentName:\"pre\"},{className:\"language-python\"}),`A = Array('i', 10)\nA = range(10)\n`)),mdx(\"p\",null,\"With \",mdx(\"strong\",{parentName:\"p\"},\"Array\"),\", we can now see that the global variable \",mdx(\"strong\",{parentName:\"p\"},\"A\"),\" is updated and reflected in the parent process. Also with \",mdx(\"strong\",{parentName:\"p\"},\"Array\"),\", we can get automatic synchronization with locks that manage by multiprocessing so that the shared data is process-safe and only one process can access the data.\"),mdx(\"pre\",null,mdx(\"code\",e({parentName:\"pre\"},{className:\"language-markdown:Output\"}),`child 3: [2, 1, 3, 4, 4, 5, 6, 7, 8, 9]\nchild 7: [2, 1, 3, 5, 5, 7, 6, 7, 8, 9]\nchild 5: [2, 1, 3, 5, 5, 5, 6, 7, 8, 9]\nchild 2: [2, 1, 3, 3, 4, 5, 6, 7, 8, 9]\nchild 0: [1, 1, 2, 3, 4, 5, 6, 7, 8, 9]\nchild 1: [2, 1, 2, 3, 4, 5, 6, 7, 8, 9]\nchild 4: [2, 1, 3, 5, 4, 5, 6, 7, 8, 9]\nchild 8: [2, 1, 3, 5, 5, 8, 6, 7, 8, 9]\nchild 9: [2, 1, 3, 5, 5, 8, 6, 8, 8, 9]\nchild 6: [2, 1, 3, 5, 5, 6, 6, 7, 8, 9]\nparent: [2, 1, 3, 5, 5, 8, 6, 8, 8, 9]\n`)),mdx(\"hr\",null),mdx(\"h2\",null,\"Share large Numpy arrays between child processes\"),mdx(\"p\",null,\"For each task, as we pass data as arguments to the processes, the data will be pickled so that it can be sent from one process to other. If we pass large amounts of data, pickling involves a huge amount of memory and consumes more time. So, it is better to \",mdx(\"a\",e({parentName:\"p\"},{href:\"https://research.wmz.ninja/articles/2018/03/on-sharing-large-arrays-when-using-pythons-multiprocessing.html\"}),\"share large data between child processes\"),\" instead of passing the data individually. \"),mdx(\"p\",null,\"As we have seen in the above approach that copy-on-write sharing is good for read-only and to work with data that changes inside the child process, we have to share the data using a shared array. In this section, we will discuss sharing large Numpy arrays using a shared array.\"),mdx(\"p\",null,\"We know that shared arrays only support primitive \",mdx(\"strong\",{parentName:\"p\"},\"C\"),\" data types and mainly 1D objects. But, how to share the Numpy arrays which are multidimensional in general to the child processes as shared ctypes do not directly support Numpy arrays? We can share Numpy arrays with some work around that is explained below.\"),mdx(\"p\",null,\"The shared ctypes objects we get are allocated from \",mdx(\"a\",e({parentName:\"p\"},{href:\"https://docs.python.org/3/c-api/buffer.html\"}),\"buffer memory\"),\" memory. A \",mdx(\"a\",e({parentName:\"p\"},{href:\"http://jakevdp.github.io/blog/2014/05/05/introduction-to-the-python-buffer-protocol/\"}),\"buffer protocol\"),\" is a framework in Python designed to provide a mechanism for Python objects to share their data among objects. Any Python objects that are implemented in C-APIs can export a set of functions called the \",mdx(\"strong\",{parentName:\"p\"},\"buffer interface\"),\". With this buffer interface, \",mdx(\"a\",e({parentName:\"p\"},{href:\"https://towardsdatascience.com/loading-binary-data-to-numpy-pandas-9caa03eb0672\"}),\"any object can expose its data to other objects\"),\" directly without the need for copying.\"),mdx(\"p\",null,\"As shared ctypes objects are just wrappers around the C data types whose memory was allocated from buffer memory. This is the reason why the child process's changes reflect in the parent process because the shared memory passed to child processes are implemented as \",mdx(\"a\",e({parentName:\"p\"},{href:\"https://docs.python.org/3/library/stdtypes.html#memoryview\"}),\"memoryview\"),\" objects.\"),mdx(\"p\",null,\"Consider the following example where we first create a large Numpy array of shape (1000, 1000), and using the process pool we assign the row number to every element in that row. As shared array doesn't support multidimensional and custom data types, a common approach is to pass the Numpy array to every worker and assign the row with a row number. But, passing the large arrays between processes take huge memory and latency. So, we utilize the buffer protocol here. Since shared array objects are provided with a buffer interface, we can rely on this shared memory and make it global so that there is no need to pass Numpy arrays as arguments to each process.\"),mdx(\"pre\",null,mdx(\"code\",e({parentName:\"pre\"},{className:\"language-python\"}),`def assign_int(i):\n    arr = np.frombuffer(np_x.get_obj(), dtype=np.int32).reshape(np_x_shape)\n    arr[i, :] = i\n\ndef pool_initializer(X, X_shape):\n    global np_x\n    np_x = X\n    global np_x_shape\n    np_x_shape = X_shape\n\nX_shape = (1000, 1000)\ndata = np.zeros(X_shape, dtype=np.int32)\nX = Array('i', X_shape[0] * X_shape[1])\n# X as a Numpy array\nX_np = np.frombuffer(X.get_obj(), dtype=np.int32).reshape(X_shape)\n# copy data to the shared array\nnp.copyto(X_np, data)\n\nwith Pool(processes=cpu_count(), initializer=pool_initializer, initargs=(X, X_shape)) as pool:\n    pool.map(assign_int, range(X_shape[0]))\n\nprint(f'Numpy array X_np:\\\\n{X_np}')\n`)),mdx(\"p\",null,\"First, we defined the shape of the array \",mdx(\"strong\",{parentName:\"p\"},\"X_Shape\"),\", and then created a Numpy array with zeros of shape \",mdx(\"strong\",{parentName:\"p\"},\"X_Shape\"),\". Second, we have created a synchronized shared array and assigned it to \",mdx(\"strong\",{parentName:\"p\"},\"X\"),\". Third, we wrapped the shared array as Numpy using \",mdx(\"strong\",{parentName:\"p\"},\"np.frombuffer\"),\".\"),mdx(\"p\",null,mdx(\"strong\",{parentName:\"p\"},\"np.frombuffer\"),\" takes a 1-dimensional buffer array and interprets it into a Numpy array so we can manipulate the array easily. We used \",mdx(\"em\",{parentName:\"p\"},\"X.get_obj()\"),\" instead \",mdx(\"strong\",{parentName:\"p\"},\"X\"),\" because \",mdx(\"strong\",{parentName:\"p\"},\"X\"),\" is a synchronized wrapper around the raw array and calling the \",mdx(\"strong\",{parentName:\"p\"},\"get_obj()\"),\" returns the raw buffer object.\"),mdx(\"blockquote\",null,mdx(\"p\",{parentName:\"blockquote\"},\"For raw arrays (RawArray), objects should be passed normally without calling get_obj().\")),mdx(\"p\",null,\"Why use \",mdx(\"a\",e({parentName:\"p\"},{href:\"https://www.educba.com/numpy-frombuffer/\"}),mdx(\"strong\",{parentName:\"a\"},\"np.frombuffer\")),\"? Since Numpy arrays take a large amount of memory space, we don't want to create a copy that again takes large memory. So, using \",mdx(\"strong\",{parentName:\"p\"},\"np.frombuffer\"),\" by utilizing the buffer protocol, we can get a Numpy array which is just a wrapper around the buffer memory. \"),mdx(\"p\",null,\"In \",mdx(\"strong\",{parentName:\"p\"},\"initiargs\"),\", we should pass the shared array instead Numpy wrapper. We also pass the shape of the Numpy array as we need to reshape the 1D shared array into a multidimensional array in the worker function \",mdx(\"em\",{parentName:\"p\"},\"assign_int()\"),\".\"),mdx(\"p\",null,\"In the worker function \",mdx(\"em\",{parentName:\"p\"},\"assign_int()\"),\", again we interpreted the buffer as a Numpy array and assigned the row values at row number \",mdx(\"strong\",{parentName:\"p\"},\"i\"),\".\"),mdx(\"p\",null,\"At last, in the parent process, we can check the multiprocessing assignment of the Numpy array.\"),mdx(\"pre\",null,mdx(\"code\",e({parentName:\"pre\"},{className:\"language-markdown:Output\"}),`Numpy array X_np:\n[[  0   0   0 ...   0   0   0]\n [  1   1   1 ...   1   1   1]\n [  2   2   2 ...   2   2   2]\n ...\n [997 997 997 ... 997 997 997]\n [998 998 998 ... 998 998 998]\n [999 999 999 ... 999 999 999]]\n`)),mdx(\"hr\",null),mdx(\"p\",null,\"Even though \",mdx(\"strong\",{parentName:\"p\"},\"multiprocessing\"),\" looks easy and flexible to use, there are some issues one can face with \",mdx(\"strong\",{parentName:\"p\"},\"multiprocessing\"),\" if not careful,\"),mdx(\"ul\",null,mdx(\"li\",{parentName:\"ul\"},mdx(\"a\",e({parentName:\"li\"},{href:\"https://pythonspeed.com/articles/python-multiprocessing/\"}),\"Why your multiprocessing Pool is stuck\")),mdx(\"li\",{parentName:\"ul\"},mdx(\"a\",e({parentName:\"li\"},{href:\"https://superfastpython.com/multiprocessing-best-practices/\"}),\"Multiprocessing Best Practices\")),mdx(\"li\",{parentName:\"ul\"},mdx(\"a\",e({parentName:\"li\"},{href:\"https://sefiks.com/2021/07/05/handling-hang-in-python-multiprocessing/\"}),\"Handling Hang in Python Multiprocessing\")),mdx(\"li\",{parentName:\"ul\"},mdx(\"a\",e({parentName:\"li\"},{href:\"https://pythonspeed.com/articles/parallelism-slower/\"}),\"The Parallelism Blues: when faster code is slower\")),mdx(\"li\",{parentName:\"ul\"},mdx(\"a\",e({parentName:\"li\"},{href:\"https://www.cloudcity.io/blog/2019/02/27/things-i-wish-they-told-me-about-multiprocessing-in-python/\"}),\"Things I Wish They Told Me About Multiprocessing in Python\")),mdx(\"li\",{parentName:\"ul\"},mdx(\"a\",e({parentName:\"li\"},{href:\"https://towardsdatascience.com/exception-handling-in-methods-of-the-multiprocessing-pool-class-in-python-7fbb73746c26\"}),\"Exception Handling in Methods of the Multiprocessing Pool Class in Python\"))),mdx(\"p\",null,\"In this blog, we discussed Python's \",mdx(\"strong\",{parentName:\"p\"},\"multiprocessing\"),\" module with the Pool function. Python released other modules for simple concurrent processing and better data sharing,\"),mdx(\"ul\",null,mdx(\"li\",{parentName:\"ul\"},mdx(\"a\",e({parentName:\"li\"},{href:\"https://docs.python.org/3/library/multiprocessing.html#managers\"}),\"Managers\")),mdx(\"li\",{parentName:\"ul\"},mdx(\"a\",e({parentName:\"li\"},{href:\"https://docs.python.org/3/library/multiprocessing.shared_memory.html\"}),\"Shared Memroy\")),mdx(\"li\",{parentName:\"ul\"},mdx(\"a\",e({parentName:\"li\"},{href:\"https://docs.python.org/3/library/concurrent.futures.html\"}),\"Concurrent Futures\"))),mdx(\"p\",null,\"On top of internal libraries, there are multiple good external libraries available for parallel and concurrent processing,\"),mdx(\"ul\",null,mdx(\"li\",{parentName:\"ul\"},mdx(\"a\",e({parentName:\"li\"},{href:\"https://joblib.readthedocs.io/en/latest/parallel.html\"}),\"Joblib\")),mdx(\"li\",{parentName:\"ul\"},mdx(\"a\",e({parentName:\"li\"},{href:\"https://ipyparallel.readthedocs.io/en/latest/tutorial/intro.html\"}),\"IPyParallel\")),mdx(\"li\",{parentName:\"ul\"},mdx(\"a\",e({parentName:\"li\"},{href:\"https://docs.ray.io/en/master/index.html\"}),\"Ray\")),mdx(\"li\",{parentName:\"ul\"},mdx(\"a\",e({parentName:\"li\"},{href:\"https://www.dask.org/\"}),\"Dask\"))),mdx(\"p\",null,\"For comparison among internal and external libraries,\"),mdx(\"ul\",null,mdx(\"li\",{parentName:\"ul\"},mdx(\"a\",e({parentName:\"li\"},{href:\"https://www.anyscale.com/blog/parallelizing-python-code\"}),\"Parallelizing Python Code\")),mdx(\"li\",{parentName:\"ul\"},mdx(\"a\",e({parentName:\"li\"},{href:\"https://cosmiccoding.com.au/tutorials/multiprocessing\"}),\"Multiprocessing In Python: Core vs libraries\")),mdx(\"li\",{parentName:\"ul\"},mdx(\"a\",e({parentName:\"li\"},{href:\"https://luis-sena.medium.com/sharing-big-numpy-arrays-across-python-processes-abf0dc2a0ab2\"}),\"Sharing big NumPy arrays across python processes\"))))}MDXContent.isMDXComponent=!0;\n","scope":{}},"id":"super-fast-python-multi-processing"},"__N_SSG":true}