{"pageProps":{"postMetadata":{"title":"Super fast Python (Part-4): Cython","description":"Convert slow Python code to run as fast as C/C++ using Cython.","imgName":"super-fast-python-cython/super-fast-python-cython.jpg","date":"Nov 18, 2022","tags":["python-performance","python"],"keywords":["cython","python-performance","python-optimize","python","fast-python","speed"],"id":"super-fast-python-cython"},"postContent":{"compiledSource":"var c=Object.defineProperty,m=Object.defineProperties;var y=Object.getOwnPropertyDescriptors;var i=Object.getOwnPropertySymbols;var r=Object.prototype.hasOwnProperty,p=Object.prototype.propertyIsEnumerable;var s=(t,n,a)=>n in t?c(t,n,{enumerable:!0,configurable:!0,writable:!0,value:a}):t[n]=a,e=(t,n)=>{for(var a in n||(n={}))r.call(n,a)&&s(t,a,n[a]);if(i)for(var a of i(n))p.call(n,a)&&s(t,a,n[a]);return t},l=(t,n)=>m(t,y(n));var h=(t,n)=>{var a={};for(var o in t)r.call(t,o)&&n.indexOf(o)<0&&(a[o]=t[o]);if(t!=null&&i)for(var o of i(t))n.indexOf(o)<0&&p.call(t,o)&&(a[o]=t[o]);return a};const layoutProps={},MDXLayout=\"wrapper\";function MDXContent(a){var o=a,{components:t}=o,n=h(o,[\"components\"]);return mdx(MDXLayout,l(e(e({},layoutProps),n),{components:t,mdxType:\"MDXLayout\"}),mdx(\"p\",null,mdx(\"img\",e({parentName:\"p\"},{src:\"super-fast-python-cython/super-fast-python-cython.jpg\",alt:\"Super fast Python: Cython\"}))),mdx(\"h6\",null,\"Published on: \",mdx(\"strong\",{parentName:\"h6\"},\"Nov 18, 2022\")),mdx(\"h1\",null,\"Super fast Python (Part-4): Cython\"),mdx(\"p\",null,\"This is the fourth post in the series on Python performance and Optimization. The series points out the utilization of inbuilt libraries, low-level code conversions, and other Python implementations to speed-up Python. The other posts included in this series are \"),mdx(\"ul\",null,mdx(\"li\",{parentName:\"ul\"},\"(Part-1): \",mdx(\"a\",e({parentName:\"li\"},{href:\"https://santhalakshminarayana.github.io/blog/super-fast-python-why-python-slow\"}),\"Why Python is slow?\")),mdx(\"li\",{parentName:\"ul\"},\"(Part-2): \",mdx(\"a\",e({parentName:\"li\"},{href:\"https://santhalakshminarayana.github.io/blog/super-fast-python-good-practices\"}),\"Good practices to write fast Python code\")),mdx(\"li\",{parentName:\"ul\"},\"(Part-3): \",mdx(\"a\",e({parentName:\"li\"},{href:\"https://santhalakshminarayana.github.io/blog/super-fast-python-multi-processing\"}),\"Multi-processing in Python\")),mdx(\"li\",{parentName:\"ul\"},\"(Part-4): Use Cython to get speed as fast as C (this post)\"),mdx(\"li\",{parentName:\"ul\"},\"(Part-5): \",mdx(\"a\",e({parentName:\"li\"},{href:\"https://santhalakshminarayana.github.io/blog/super-fast-python-numba\"}),\"Use Numba to speed up Python Functions and Numeric calculations\"))),mdx(\"p\",null,\"In the last post, we discussed \",mdx(\"strong\",{parentName:\"p\"},\"multiprocessing\"),\" to optimize Python code by utilizing parallel computing with multiple CPU cores. Multi-processing is useful when we can split certain parts of code into parallel tasks and then execute them parallelly. \"),mdx(\"p\",null,\"Imagine when we don't have any parallelizable code and it is taking huge time in Python compared to \",mdx(\"strong\",{parentName:\"p\"},\"C/C++\"),\", how to optimize the code then? One thing we can do is to convert the Python code into a low-level programming language like C/C++ and \",mdx(\"a\",e({parentName:\"p\"},{href:\"https://docs.python.org/3/extending/extending.html\"}),\"embed that C/C++ code in Python\"),\". Understanding and writing C/C++ code is hard for someone who is not familiar with C/C++. Fortunately, we can get the performance speed as fast as C/C++ by writing the Python code in \",mdx(\"a\",e({parentName:\"p\"},{href:\"https://cython.org/\"}),\"Cython\"),\" which is a superset of Python that provides functionality to write C-Extensions for Python.\"),mdx(\"h2\",null,\"How Cython can improve Speed?\"),mdx(\"p\",null,\"In our previous discussion on \",mdx(\"a\",e({parentName:\"p\"},{href:\"https://santhalakshminarayana.github.io/blog/super-fast-python-why-python-slow\"}),\"Why Python is slow?\"),\", we learned that the major speed issues arise in Python due to\"),mdx(\"ul\",null,mdx(\"li\",{parentName:\"ul\"},\"interpretation of generated bytecode\"),mdx(\"li\",{parentName:\"ul\"},\"dynamic types and their management\")),mdx(\"p\",null,\"With Cython, we can take care of the above problems with both compiled code instead of interpretation and static typing instead of dynamic typing. \"),mdx(\"p\",null,\"Cython translates the Python code into C extension code and compiles the C code into an object code that can be imported directly into Python. Also, we can make some changes like adding static types that improve the execution speed drastically over dynamic typing. Cython also supports the usage of C/C++ libraries and functions that are super-fast compared to Python libraries and functions.\"),mdx(\"h3\",null,\"Install Cython\"),mdx(\"p\",null,mdx(\"a\",e({parentName:\"p\"},{href:\"https://cython.readthedocs.io/en/stable/src/quickstart/install.html\"}),\"Install the Cython\"),\" with Pip as follows\"),mdx(\"pre\",null,mdx(\"code\",e({parentName:\"pre\"},{className:\"language-bash\"}),`pip install Cython\n`)),mdx(\"blockquote\",null,mdx(\"p\",{parentName:\"blockquote\"},\"To compile the C code into an object file, we need a C compiler. Ubuntu comes with \",mdx(\"strong\",{parentName:\"p\"},\"gcc\"),\" by default. For other platforms like Windows, install the C compiler if not installed previously.\")),mdx(\"hr\",null),mdx(\"h2\",null,\"Cython usage\"),mdx(\"p\",null,\"There are multiple ways to use Cython like building manually,  using in Jupyter as an extension, or importing directly like a Python module without compilation using \",mdx(\"em\",{parentName:\"p\"},\"pyximport\"),\".\"),mdx(\"h3\",null,\"Build a Cython module manually\"),mdx(\"p\",null,\"We write the Cython code in a file with the extension \",mdx(\"em\",{parentName:\"p\"},\".pyx\"),\" instead of the normal Python extension \",mdx(\"em\",{parentName:\"p\"},\".py\"),\".\"),mdx(\"p\",null,\"The compiler translates '.pyx' Cython file into a '.c' C file and then compiles that C file to a sharable object file '.so' (or '.pyd' on Windows). We tell the compiler those build instructions and compilation options by writing a \",mdx(\"a\",e({parentName:\"p\"},{href:\"https://cython.readthedocs.io/en/stable/src/userguide/source_files_and_compilation.html#basic-setup-py\"}),\"setup.py\"),\" file.\"),mdx(\"h3\",null,\"Cython compilation\"),mdx(\"ul\",null,mdx(\"li\",{parentName:\"ul\"},\"Translate the \",mdx(\"em\",{parentName:\"li\"},\".pyx\"),\" source code to a \",mdx(\"em\",{parentName:\"li\"},\".c\"),\" file with additional wrappers of Python extension code.\"),mdx(\"li\",{parentName:\"ul\"},\"Compile the \",mdx(\"em\",{parentName:\"li\"},\".c\"),\" file with a C compiler to a platform-specific shared object file \",mdx(\"em\",{parentName:\"li\"},\".so\"),\" that can be imported directly into Python.\")),mdx(\"pre\",null,mdx(\"code\",e({parentName:\"pre\"},{className:\"language-python:calculate_y_cython.pyx\"}),`def fx(x, a, b, c):\n    d = (a + b) * c\n    return a*x + b*(x**2) + c*(x**3) + d\n\ndef y(x, n, a, b, c):\n    af = fx(x, a, b, c)**2\n    k = abs(n//2 - x)\n    bf = fx(k, a, b, c)\n    return (af-bf)/(n-1 + 1e-12)\n\ndef calculate_y_cython(n):\n    ys = []\n    a, b, c = 2, 5, -4\n    for i in range(n):\n        ys.append(y(i, n, a, b, c))\n    \n    return ys\n`)),mdx(\"p\",null,\"The above file \",mdx(\"em\",{parentName:\"p\"},\"calculate_y.pyx\"),\" contains Cython code that looks the same as Python without any optimizations. Now to compile the above file, write a \",mdx(\"em\",{parentName:\"p\"},\"setup.py\"),\" file as following\"),mdx(\"pre\",null,mdx(\"code\",e({parentName:\"pre\"},{className:\"language-python:setup.py\"}),`from distutils.core import setup\nfrom Cython.Build import cythonize\n\nsetup(\n    name='Calculate Expression Y',\n    ext_modules=cythonize(\n        \"calculate_y_cython.pyx\", \n        compiler_directives={\"language_level\": \"3\"},\n    )\n)\n`)),mdx(\"p\",null,\"In the above \",mdx(\"em\",{parentName:\"p\"},\"setup.py\"),\", for the \",mdx(\"strong\",{parentName:\"p\"},\"setup()\"),\", we have passed the optional name to our Cython module for \",mdx(\"em\",{parentName:\"p\"},\"name\"),\" and the path to the \",mdx(\"em\",{parentName:\"p\"},\".pyx\"),\" file for the \",mdx(\"em\",{parentName:\"p\"},\"ext_module\"),\" parameter.\"),mdx(\"p\",null,\"Build the sharable object file '.so' using the following command in the terminal\"),mdx(\"pre\",null,mdx(\"code\",e({parentName:\"pre\"},{className:\"language-bash\"}),`python setup.py build_ext --inplace\nor\npython setup.py build_ext --inplace --quiet\n`)),mdx(\"p\",null,\"This will generate a translated '.c' C file and a compiled '.so' file.\"),mdx(\"p\",null,\"We can import the above compiled \",mdx(\"em\",{parentName:\"p\"},\"calculate_y_cython\"),\" module directly into Python runtime.\"),mdx(\"pre\",null,mdx(\"code\",e({parentName:\"pre\"},{className:\"language-python:main.py\"}),`from time import perf_counter\nfrom calculate_y_cython import calculate_y_cython\n\ndef fx(x, a, b, c):\n    d = (a + b) * c\n    return a*x + b*(x**2) + c*(x**3) + d\n\ndef y(x, n, a, b, c):\n    af = fx(x, a, b, c)**2\n    k = abs(n//2 - x)\n    bf = fx(k, a, b, c)\n    return (af-bf)/(n-1 + 1e-12)\n\ndef calculate_y_py(n):\n    ys = []\n    a, b, c = 2, 5, -4\n    for i in range(n):\n        ys.append(y(i, n, a, b, c))\n    \n    return ys\n\ndef main():\n    n = 100000\n    # Python implementation\n    atime = perf_counter()\n    res = calculate_y_py(n)\n    print(f'Python Time: {perf_counter()-atime:.2}')\n    \n    atime = perf_counter()\n    res = calculate_y_cython(n)\n    print(f'Cython Time: {perf_counter()-atime:.2}')\n    \nif __name__==\"__main__\":\n    main()\n\n\"\"\"Output:\nPython Time: 0.19\nCython Time: 0.16\n\"\"\"\n`)),mdx(\"blockquote\",null,mdx(\"p\",{parentName:\"blockquote\"},\"At the time of writing, the latest Python version is Python 3.11 which is incredibly faster (30-60% in some cases) than earlier versions. So, to understand the Cython potential, I'm running the scripts in Python 3.8.10 on my old system with 8GB Intel(R) i5-8250U 1.60GHz CPU on HP Laptop 15-da0xxx.\")),mdx(\"p\",null,\"In the above \",mdx(\"em\",{parentName:\"p\"},\"main.py\"),\", we have imported the \",mdx(\"em\",{parentName:\"p\"},\"calculate_y_cython\"),\" module at line 2. If we look at the output to check the time taken for normal Python implementation and Cython version, they are \",mdx(\"strong\",{parentName:\"p\"},\"0.19\"),\" and \",mdx(\"strong\",{parentName:\"p\"},\"0.16\"),\" seconds respectively. The time difference is very low and we didn't gain much from Cython because we haven't done any optimization steps like \"),mdx(\"ul\",null,mdx(\"li\",{parentName:\"ul\"},\"static typing\"),mdx(\"li\",{parentName:\"ul\"},\"limit calling Python's libraries\"),mdx(\"li\",{parentName:\"ul\"},\"reducing Python's PyObject usage\")),mdx(\"h3\",null,\"Cython Annotations\"),mdx(\"p\",null,\"Cython provides an easy way to check where we can optimize our Cython code by using Cython annotate feature. With the following command (\",mdx(\"em\",{parentName:\"p\"},\"-a\"),\" denotes annotate and \",mdx(\"em\",{parentName:\"p\"},\"-3\"),\" denotes \",mdx(\"strong\",{parentName:\"p\"},\"language_level\"),\" which is Python3), cython generates an HTML file that we can open in the browser to check for optimizable code. Another option is to pass the \",mdx(\"strong\",{parentName:\"p\"},\"annotate=True\"),\" parameter to \",mdx(\"em\",{parentName:\"p\"},\"cythonize()\"),\" function call in \",mdx(\"strong\",{parentName:\"p\"},\"ext_modules\"),\" in \",mdx(\"em\",{parentName:\"p\"},\"setup\"),\".\"),mdx(\"pre\",null,mdx(\"code\",e({parentName:\"pre\"},{className:\"language-bash\"}),`cython -a calculate_y_cython.pyx -3\n`)),mdx(\"p\",null,\"If we open the generated HTML file in the browser, it will look like this\"),mdx(\"p\",null,mdx(\"img\",e({parentName:\"p\"},{src:\"super-fast-python-cython/cython-annotations.png\",alt:\"Cython Annotation:=:80\"}))),mdx(\"p\",null,\"The more yellow lines the more interaction with the Python interpreter. Our goal should be converting as many yellow lines as to white lines that denote pure Cython code. We discuss the optimization part in a later section.\"),mdx(\"h3\",null,\"Cython as an extension in Jupyter\"),mdx(\"p\",null,\"Cython can be imported and used in Jupyter directly as an extension without the need for any additional build/compilation steps. \"),mdx(\"p\",null,\"First load the Cython extension using \",mdx(\"em\",{parentName:\"p\"},\"%load_ext cython\"),\", and then, for the cell that is to be Cythonized, use the magic command \",mdx(\"em\",{parentName:\"p\"},\"%%cython\"),\" at the top of that cell as shown in the following image.\"),mdx(\"p\",null,mdx(\"img\",e({parentName:\"p\"},{src:\"super-fast-python-cython/cython-jupyter.png\",alt:\"Cython Jupyter:=:40\"}))),mdx(\"p\",null,\"We can show the interactive Cython annotations in Jupyter just like we have generated the HTML file above. To show annotations, pass annotate option to \",mdx(\"em\",{parentName:\"p\"},\"%%cython -a\"),\" magic command.\"),mdx(\"h3\",null,\"Import '.pyx' using pyximport\"),mdx(\"p\",null,\"While developing or debugging, for each change in the '.pyx' file, running \",mdx(\"em\",{parentName:\"p\"},\"setup.py\"),\" is a repetitive task and cumbersome. Instead, we can dynamically import '.pyx' to Python directly using \",mdx(\"a\",e({parentName:\"p\"},{href:\"https://cython.readthedocs.io/en/stable/src/userguide/source_files_and_compilation.html#pyximport\"}),\"pyximport\"),\" without any external build and compilation. \",mdx(\"em\",{parentName:\"p\"},\"pyximport\"),\" takes care of compiling and building in the background without calling \",mdx(\"em\",{parentName:\"p\"},\"cythonize()\"),\" internally. So, while importing the '.pyx' file, it will take some time to be imported as a regular Python module.\"),mdx(\"pre\",null,mdx(\"code\",e({parentName:\"pre\"},{className:\"language-python\"}),`import pyximport\npyximport.install(language_level=3)\n\nfrom calculate_y_cython import calculate_y_cython\n`)),mdx(\"p\",null,\"Though it is easy to work with Cython using \",mdx(\"strong\",{parentName:\"p\"},\"pyximport\"),\", there are some \",mdx(\"a\",e({parentName:\"p\"},{href:\"https://cython.readthedocs.io/en/stable/src/userguide/source_files_and_compilation.html#limitations\"}),\"limitations with pyximport\"),\" and it is also not flexible as normal setup.\"),mdx(\"blockquote\",null,mdx(\"p\",{parentName:\"blockquote\"},\"It is not recommended to use \",mdx(\"strong\",{parentName:\"p\"},\"pyximport\"),\" while distributing Python packages and modules.\")),mdx(\"hr\",null),mdx(\"h2\",null,\"Optimize Cython\"),mdx(\"p\",null,\"In the previous section, we have seen in the Cython annotations HTML file that many areas in the code need to be optimized for more speed. There are several ways to improve speed like\"),mdx(\"ul\",null,mdx(\"li\",{parentName:\"ul\"},\"define static types\"),mdx(\"li\",{parentName:\"ul\"},\"use C-libraries and functions\"),mdx(\"li\",{parentName:\"ul\"},\"utilize OpenMP for parallel computing\")),mdx(\"h3\",null,\"Define static types to variables\"),mdx(\"p\",null,\"Since Python is a dynamic typing language, we can define C-like data types for Python variables in Cython. To declare C variables, prefix the \",mdx(\"strong\",{parentName:\"p\"},\"cdef\"),\" keyword to the variable declaration which is the same as declaring variables in C.\"),mdx(\"p\",null,\"The syntax for variable declaration is\"),mdx(\"pre\",null,mdx(\"code\",e({parentName:\"pre\"},{className:\"language-python\"}),`cdef type variable_name = initilization_value {optional}\n`)),mdx(\"p\",null,\"The \",mdx(\"strong\",{parentName:\"p\"},\"type\"),\" can be any of the acceptable C data types.\"),mdx(\"h3\",null,\"Define function definitions\"),mdx(\"p\",null,\"Python functions are defined using \",mdx(\"strong\",{parentName:\"p\"},\"def\"),\" and \",mdx(\"a\",e({parentName:\"p\"},{href:\"https://cython.readthedocs.io/en/latest/src/userguide/language_basics.html#python-functions-vs-c-functions\"}),\"C functions in Cython\"),\" are defined with the keyword \",mdx(\"strong\",{parentName:\"p\"},\"cdef\"),\". The difference between \",mdx(\"strong\",{parentName:\"p\"},\"def\"),\" and \",mdx(\"strong\",{parentName:\"p\"},\"cdef\"),\" is that with the former declaration, it can be called from anywhere both local and external modules where as \",mdx(\"strong\",{parentName:\"p\"},\"cdef\"),\" functions are only module level. Also, Cython wraps the \",mdx(\"strong\",{parentName:\"p\"},\"def\"),\" function that is defined inside '.pyx' into a Python object. There is another declaration called \",mdx(\"strong\",{parentName:\"p\"},\"cpdef\"),\" which behaves as \",mdx(\"strong\",{parentName:\"p\"},\"def\"),\" when called from outside the module and behaves as \",mdx(\"strong\",{parentName:\"p\"},\"cdef\"),\" inside the module, so it is faster inside the same module function call.\"),mdx(\"p\",null,\"Cython also provides support for writing function definitions just like C. We can define parameter types and return types. \"),mdx(\"pre\",null,mdx(\"code\",e({parentName:\"pre\"},{className:\"language-python\"}),`cdef(or cpdef) type function_name(type parameter1, ...)\n`)),mdx(\"p\",null,\"If no type is specified, the parameters and return values are treated as Python objects which need Python interpretation and they are slow.\"),mdx(\"p\",null,\"Now, make some changes to \",mdx(\"em\",{parentName:\"p\"},\"calculate_y_cython.pyx\"),\" with static type declarations and function definitions as,\"),mdx(\"blockquote\",null,mdx(\"p\",{parentName:\"blockquote\"},mdx(\"a\",e({parentName:\"p\"},{href:\"https://cython.readthedocs.io/en/stable/src/tutorial/external.html\"}),\"Call the C functions in Cython\"),\" inplace of Python functions that reduces the Python interaction.\")),mdx(\"pre\",null,mdx(\"code\",e({parentName:\"pre\"},{className:\"language-python:calculate_y_cython.pyx\"}),`ctypedef long int li\nctypedef long long int lli\n\ncdef lli fx(li x, int a, int b, int c):\n    cdef int d = (a + b) * c\n    return a*x + b*(x**2) + c*(x**3) + d\n\ncdef double y(li x, li n, int a, int b, int c):\n    cdef:\n        lli af = fx(x, a, b, c)**2\n        li k = abs(n//2 - x)\n        lli bf = fx(k, a, b, c)\n    return (af-bf)/(n-1 + 1e-12)\n\ncpdef calculate_y_cython(li n):\n    ys = []\n    cdef:\n        int a = 2, b = 5, c = -4\n        li i = 0\n    for i in range(n):\n        ys.append(y(i, n, a, b, c))\n    \n    return ys\n`)),mdx(\"blockquote\",null,mdx(\"p\",{parentName:\"blockquote\"},\"speed can be improved further by disabling bound checking(@cython.boundscheck(False)) and negative indexing(@cython.wraparound(False)) \",mdx(\"a\",e({parentName:\"p\"},{href:\"https://cython.readthedocs.io/en/stable/src/userguide/source_files_and_compilation.html#compiler-directives\"}),\"compiler directive instructions\"),\".\")),mdx(\"p\",null,\"Check the annotations for the Cython code, most of the yellow lines are now changed to white and only list operations are dark yellow because lists are Python objects. In a later section, we discuss optimizing lists using C arrays.\"),mdx(\"p\",null,mdx(\"img\",e({parentName:\"p\"},{src:\"super-fast-python-cython/optimized_cython.jpg\",alt:\"Optimized Cython Annotation:=:70\"}))),mdx(\"p\",null,\"If we check the time for the optimized Cython code,\"),mdx(\"pre\",null,mdx(\"code\",e({parentName:\"pre\"},{className:\"language-python\"}),`%%timeit -n 100\nn = 100000\nres = calculate_y_cython(n)\n\n\"\"\"Output:\n2.04 ms \\xB1 166 \\xB5s per loop (mean \\xB1 std. dev. of 7 runs, 100 loops each)\n\"\"\"\n`)),mdx(\"p\",null,\"it takes \",mdx(\"strong\",{parentName:\"p\"},\"0.002\"),\" seconds which is approximately \",mdx(\"strong\",{parentName:\"p\"},\"100x\"),\" times faster than the normal Python version that takes \",mdx(\"strong\",{parentName:\"p\"},\"0.19\"),\" seconds. By adding only static type and some tweaks, we made Python 100x faster. The powers of Cython are not limited to only static typing. We can further speed up the code with Numpy.\"),mdx(\"hr\",null),mdx(\"h2\",null,\"1000x times faster with MemoryView and Numpy\"),mdx(\"p\",null,\"In the Cython annotation snippet above, we see that the list operations of \",mdx(\"strong\",{parentName:\"p\"},\"ys\"),\" are still yellow as \",mdx(\"em\",{parentName:\"p\"},\"list()\"),\" is a python object and Cython cannot optimize Python objects interaction. \"),mdx(\"p\",null,\"To solve this, we can convert the list type to \",mdx(\"a\",e({parentName:\"p\"},{href:\"https://cython.readthedocs.io/en/stable/src/tutorial/array.html\"}),\"memoryview arrays\"),\", and operations like \",mdx(\"em\",{parentName:\"p\"},\"append()\"),\" to indexing just like looping in C.\"),mdx(\"pre\",null,mdx(\"code\",e({parentName:\"pre\"},{className:\"language-python:calculate_y_cython.pyx\"}),`cimport cython\nimport numpy as np\ncimport numpy as np\n\nctypedef long int li\nctypedef long long int lli\n\n@cython.boundscheck(False)  # Deactivate bounds checking\n@cython.wraparound(False)   # Deactivate negative indexing\ncdef lli fx(li x, int a, int b, int c):\n    cdef int d = (a + b) * c\n    return a*x + b*(x**2) + c*(x**3) + d\n\n@cython.boundscheck(False)\n@cython.wraparound(False)\ncdef double y(li x, li n, int a, int b, int c):\n    cdef:\n        lli af = fx(x, a, b, c)**2\n        li k = abs(n//2 - x)\n        lli bf = fx(k, a, b, c)\n    return (af-bf)/(n-1 + 1e-12)\n\n@cython.boundscheck(False)\n@cython.wraparound(False)\ncpdef calculate_y_cython(li n):\n    cdef double[:] ys = np.empty(n, dtype=np.float64)\n    cdef:\n        int a = 2, b = 5, c = -4\n        li i = 0\n    for i in range(n):\n        ys[i] = y(i, n, a, b, c)\n    return ys\n`)),mdx(\"p\",null,\"Before building the object code, we need to change \",mdx(\"a\",e({parentName:\"p\"},{href:\"https://cython.readthedocs.io/en/stable/src/tutorial/numpy.html\"}),\"build instructions to link Numpy\"),\" as a dependency like following\"),mdx(\"pre\",null,mdx(\"code\",e({parentName:\"pre\"},{className:\"language-python:setup.py\"}),`from distutils.core import setup\nfrom distutils.extension import Extension\nfrom Cython.Build import cythonize\nimport numpy\n\next_modules = [\n    Extension(\"calculate_y_function\",\n              sources=[\"calculate_y_cython.pyx\"],\n              libraries=[\"m\"],\n              compiler_directives={\"language_level\": \"3\"},\n              )\n]\n\nsetup(name=\"calculate Y function\",\n      ext_modules=cythonize(ext_modules),\n      include_dirs=[numpy.get_include()])\n`)),mdx(\"p\",null,\"The parameter \",mdx(\"em\",{parentName:\"p\"},\"include_dirs\"),\" includes external libraries like Numpy here.\"),mdx(\"pre\",null,mdx(\"code\",e({parentName:\"pre\"},{className:\"language-python\"}),`%%timeit -n 1000\nn = 100000\nres = calculate_y_cython(n)\n\n\"\"\"Output:\n208 \\xB5s \\xB1 11.3 \\xB5s per loop (mean \\xB1 std. dev. of 7 runs, 1000 loops each)\n\"\"\"\n`)),mdx(\"p\",null,\"The fully optimized version of Cython runs at \",mdx(\"strong\",{parentName:\"p\"},\"0.0002\"),\" seconds which is approximately \",mdx(\"strong\",{parentName:\"p\"},\"1000x\"),\" faster than the normal Python code. \"),mdx(\"p\",null,\"The usage of Numpy and MemoryViews in Cython needs separate discussion and I will write about Classes, C-math, Numpy, MemoryViews, and OpenMP in the Advanced Cython series later.\"),mdx(\"hr\",null),mdx(\"p\",null,\"Cython is a very powerful extension that we can use to speed up Python code. Sometimes it may not be possible to convert Python objects straight away like dictionaries (use C++ maps), so it's better to use Cython for repetitive tasks like loops, general functions with simple statements (like declaration and usage only), and math operations.\"),mdx(\"p\",null,\"Learn more about Cython by referencing\"),mdx(\"ul\",null,mdx(\"li\",{parentName:\"ul\"},mdx(\"a\",e({parentName:\"li\"},{href:\"http://blog.behnel.de/posts/tuning-basic-object-operations-in-cython.html\"}),`Speeding up basic object operations in Cython\n`)),mdx(\"li\",{parentName:\"ul\"},mdx(\"a\",e({parentName:\"li\"},{href:\"https://www.infoworld.com/article/3648539/faster-python-made-easier-with-cythons-pure-python-mode.html\"}),\"Faster Python made easier with Cython\\u2019s pure Python mode\")),mdx(\"li\",{parentName:\"ul\"},mdx(\"a\",e({parentName:\"li\"},{href:\"https://www.peterbaumgartner.com/blog/intro-to-just-enough-cython-to-be-useful/\"}),\"An Introduction to Just Enough Cython to be Useful\")),mdx(\"li\",{parentName:\"ul\"},mdx(\"a\",e({parentName:\"li\"},{href:\"https://nicolas-hug.com/blog/cython_notes\"}),\"Cython notes and tips\")),mdx(\"li\",{parentName:\"ul\"},mdx(\"a\",e({parentName:\"li\"},{href:\"https://github.com/cython/cython/issues/3974\"}),\"(Github Issue) Improve cython interface with a more user-friendly compiling interface\"))))}MDXContent.isMDXComponent=!0;\n","scope":{}},"id":"super-fast-python-cython"},"__N_SSG":true}