{"pageProps":{"postMetadata":{"title":"Super fast Python (Part-1): Why Python is Slow?","description":"Why Python is slow compared to C/C++ or Java? And where can we improve our code to run fast?","imgName":"super-fast-python-why-python-slow/super-fast-python-why-python-slow.jpg","date":"Nov 7, 2022","tags":["python-performance","python"],"keywords":["python-performance","python-optimize","python","fast-python","speed","slow-python"],"id":"super-fast-python-why-python-slow"},"postContent":{"compiledSource":"\"use strict\";\nconst {Fragment: _Fragment, jsx: _jsx, jsxs: _jsxs} = arguments[0];\nconst {useMDXComponents: _provideComponents} = arguments[0];\nfunction _createMdxContent(props) {\n  const _components = {\n    a: \"a\",\n    code: \"code\",\n    em: \"em\",\n    h1: \"h1\",\n    h2: \"h2\",\n    h3: \"h3\",\n    h6: \"h6\",\n    hr: \"hr\",\n    img: \"img\",\n    li: \"li\",\n    p: \"p\",\n    pre: \"pre\",\n    strong: \"strong\",\n    ul: \"ul\",\n    ..._provideComponents(),\n    ...props.components\n  };\n  return _jsxs(_Fragment, {\n    children: [_jsx(_components.p, {\n      children: _jsx(_components.img, {\n        src: \"super-fast-python-why-python-slow/super-fast-python-why-python-slow.jpg\",\n        alt: \"Super fast Python: Why Python is Slow?\"\n      })\n    }), \"\\n\", _jsxs(_components.h6, {\n      children: [\"Published on: \", _jsx(_components.strong, {\n        children: \"Nov 7, 2022\"\n      })]\n    }), \"\\n\", _jsx(_components.h1, {\n      children: \"Super fast Python (Part-1): Why Python is Slow?\"\n    }), \"\\n\", _jsx(_components.p, {\n      children: \"Python is an interpreted, high-level, and dynamically typed programming language. Developers prefer Python because of its easy-to-learn, flexibility, fast development, easy-to-code, readability, and many other development choices. From nowhere in the 2000s to the most used programming language right now, Python has come a long way with help of a strong community. But, there has been always a discussion on Python's choice for computation-intensive tasks like Machine Learning as Python is generally slow compared to widely used languages like C/C++ and Java. Even with the development of computation-efficient libraries and packages like Numpy, still Python is slow for general usage.\"\n    }), \"\\n\", _jsxs(_components.p, {\n      children: [\"Python's core development team has been working to make Python as fast as C/C++. They set a goal to make each Python release significantly faster than the earlier release. The current \", _jsx(_components.a, {\n        href: \"https://docs.python.org/3.11/whatsnew/3.11.html#faster-cpython\",\n        children: \"Python 3.11 is up to 10-60 percent faster than Python 3.10\"\n      }), \". Let's hope we will reach a state where Python is at least at the same speed level as Java if not C++.\"]\n    }), \"\\n\", _jsx(_components.p, {\n      children: \"One common practice to tackle the speed issues in production is to upgrade the hardware resources or upscale the cloud infrastructure that increases the project budget. As Python's core development team is trying to improve Python, it's up to us to leverage the core libraries and code practices to make code faster at the developer's end and eventually use fewer resources and budget.\"\n    }), \"\\n\", _jsx(_components.p, {\n      children: \"This is the first post in the series on Python performance and Optimization. The series points out the utilization of inbuilt libraries, low-level code conversions, and other Python implementations to speed-up Python. The other posts included in this series are\"\n    }), \"\\n\", _jsxs(_components.ul, {\n      children: [\"\\n\", _jsx(_components.li, {\n        children: \"(Part-1): Why Python is slow? (this post)\"\n      }), \"\\n\", _jsxs(_components.li, {\n        children: [\"(Part-2): \", _jsx(_components.a, {\n          href: \"https://santhalakshminarayana.github.io/blog/super-fast-python-good-practices\",\n          children: \"Good practices to write fast Python code\"\n        })]\n      }), \"\\n\", _jsxs(_components.li, {\n        children: [\"(Part-3): \", _jsx(_components.a, {\n          href: \"https://santhalakshminarayana.github.io/blog/super-fast-python-multi-processing\",\n          children: \"Multi-processing in Python\"\n        })]\n      }), \"\\n\", _jsxs(_components.li, {\n        children: [\"(Part-4): \", _jsx(_components.a, {\n          href: \"https://santhalakshminarayana.github.io/blog/super-fast-python-cython\",\n          children: \"Use Cython to get speed as fast as C\"\n        })]\n      }), \"\\n\", _jsxs(_components.li, {\n        children: [\"(Part-5): \", _jsx(_components.a, {\n          href: \"https://santhalakshminarayana.github.io/blog/super-fast-python-numba\",\n          children: \"Use Numba to speed up Python Functions and Numeric calculations\"\n        })]\n      }), \"\\n\"]\n    }), \"\\n\", _jsx(_components.hr, {}), \"\\n\", _jsx(_components.h2, {\n      children: \"Why Python is slow?\"\n    }), \"\\n\", _jsx(_components.p, {\n      children: \"Before looking into how we can optimize the Python code, we should look at first why Python is slow.\"\n    }), \"\\n\", _jsx(_components.p, {\n      children: \"Some of the reasons for Python's slowness is due to its design of core details like how code executes, type-inference, and memory management.\"\n    }), \"\\n\", _jsx(_components.h3, {\n      children: \"Python implementation by interpretation\"\n    }), \"\\n\", _jsxs(_components.p, {\n      children: [\"Python is a programming language that talks about syntax and rules to write programs. Executing the code written is done by the \", _jsx(_components.a, {\n        href: \"https://en.wikipedia.org/wiki/Programming_language_implementation\",\n        children: \"programming language implementation\"\n      }), \". This can be of two categories - Compilation and Interpretation. \", _jsx(_components.strong, {\n        children: \"CPython\"\n      }), \" is a Python implementation written in \", _jsx(_components.strong, {\n        children: \"C\"\n      }), \" that applies an interpretation approach to execute the python code written. CPython is the default runtime and reference implementation of Python and there are other runtimes like PyPy, Cython, Jython, etc., that take different execution approaches for different use cases. CPython is both an interpreter (widely represented) and a compiler as it complies the Python code to Python bytecode and then interprets it for the specific platform using Python Virtual Machine (PVM).\"]\n    }), \"\\n\", _jsx(_components.p, {\n      children: \"CPython uses Global Interpreter Lock (GIL) on each CPython interpreter process. This means, within a single process, only a single thread processes the Python bytecode. We will see later why this behavior is both good and bad.\"\n    }), \"\\n\", _jsx(_components.p, {\n      children: \"As interpretation is usually slow compared to compilation it is understood that Python is slow, but maybe up to 2x-3x times slower than C/C++. But it is not true, Java, which also interprets the code, is still many times faster than Python and this asks questions on what are other factors for slowness in Python.\"\n    }), \"\\n\", _jsx(_components.p, {\n      children: \"Changing the runtime of Python from interpretation to compilation like Cython and embedded C-code, or JIT with PyPy, we can improve the speed of Python many times. We will talk about Cython, and how to use it with Python, in a later article.\"\n    }), \"\\n\", _jsx(_components.h3, {\n      children: \"Comes the dynamically typing comes the problem\"\n    }), \"\\n\", _jsx(_components.p, {\n      children: \"One of the beautiful features of Python is dynamic typing and many people like the way it is. But with dynamic typing, there is an additional burden on the interpreter to keep track of the type of variables that makes less scope for optimization. As Java is statically typed, the interpreter can optimize the bytecode generation and can interpret it faster than Python.\"\n    }), \"\\n\", _jsx(_components.pre, {\n      children: _jsx(_components.code, {\n        className: \"language-python\",\n        children: \"a = 1 # a as int\\nb = a * 2 # b as int\\n\\na = 'python ' # a as string\\n# c as a string with operations\\n# of string and int\\nc = a * b\\n\"\n      })\n    }), \"\\n\", _jsxs(_components.p, {\n      children: [\"In the above snippet, the interpreter has to keep track of the \", _jsx(_components.em, {\n        children: \"type\"\n      }), \" of \", _jsx(_components.strong, {\n        children: \"a\"\n      }), \" from top to bottom. If not dynamic typing is supported in Python, we have to declare types for every variable and the operation \", _jsx(_components.strong, {\n        children: \"c = a * b\"\n      }), \" is not possible then. So, with flexible support from Python, there is some overhead with the interpreter too.\"]\n    }), \"\\n\", _jsx(_components.h3, {\n      children: \"That is an object, this too\"\n    }), \"\\n\", _jsx(_components.p, {\n      children: \"In Python, everything is an object. Even functions too. If one can remember how objects are referenced in C++ (yes, the pointers), apply the same concept in Python for everything including built-in primitive (not exactly) types which are objects too and are specially taken care of.\"\n    }), \"\\n\", _jsx(_components.p, {\n      children: \"Assigning memory to the objects is done by creating actual memory to hold an object and a reference is given to the variables that point to the real object in the memory. Every time the variable changes its value, instead of changing the value in the memory, a new object is created and the variable is given the new location of the object that holds the new value. As CPython is implemented in C, objects created in Python are called PyObjects which are struct in C that refers to all Python objects.\"\n    }), \"\\n\", _jsx(_components.pre, {\n      children: _jsx(_components.code, {\n        className: \"language-python\",\n        children: \">>> a = 10\\n>>> print(id(a))\\n9801536\\n\\n>>> a = 12\\n>>> print(id(a))\\n9801600\\n\"\n      })\n    }), \"\\n\", _jsxs(_components.p, {\n      children: [\"We can see the address of \", _jsx(_components.strong, {\n        children: \"a\"\n      }), \" changes every time we change/assign the value because of how Python manages variables and their values. In C/C++, for variables, the addressing is done by creating an actual location for the variable instead of the value, and if the value changes, it just overwrites the previous value.\"]\n    }), \"\\n\", _jsx(_components.p, {\n      children: \"Python has to create new objects, keep their references, delete unused objects, and repeat the cycle. This continuous cycle of object creation and deletion whenever variable values changes make runtime slow.\"\n    }), \"\\n\", _jsxs(_components.p, {\n      children: [\"The major overhead that needs to address is Python's way of handling collections like Lists. In \", _jsx(_components.em, {\n        children: \"C\"\n      }), \", we create the arrays with fixed memory and the address of that array is fixed, and continuous memory allocation happens for all the elements starting from the fixed memory point. But in Python, for each value, an \", _jsx(_components.a, {\n        href: \"http://jakevdp.github.io/blog/2014/05/09/why-python-is-slow/\",\n        children: \"object is created\"\n      }), \" anywhere in the memory (not continuous), and the list holds only references to these objects. Working on these arbitrary memory locations make things complex and eventually takes more time.\"]\n    }), \"\\n\", _jsx(_components.pre, {\n      children: _jsx(_components.code, {\n        className: \"language-python\",\n        children: \">>> l = [1, 2, 3, 4]\\n>>> for i in l:\\n        print(id(i))\\n\\nOUTPUT:\\n-------\\n\\n9801248\\n9801280\\n9801312\\n9801344\\n\"\n      })\n    }), \"\\n\", _jsx(_components.p, {\n      children: \"In the above snippet, we can observe that the addresses for each element in the list are not the same or continuous.\"\n    }), \"\\n\", _jsx(_components.p, {\n      children: \"One of the reasons why Numpy is faster is because it creates fixed memory of the array elements. The below snippet prints out the memory address of each element in the array and they are the same, meaning Numpy create an array with continuous memory address and they are easy to operate.\"\n    }), \"\\n\", _jsx(_components.pre, {\n      children: _jsx(_components.code, {\n        className: \"language-python\",\n        children: \">>> a = np.array([1, 2, 3, 4])\\n>>> for i in a:\\n        print(i.__array_interface__['data'][0])\\n\\nOUTPUT:\\n-------\\n\\n37936064\\n37936064\\n37936064\\n37936064\\n\"\n      })\n    }), \"\\n\", _jsx(_components.h3, {\n      children: \"GIL, good and bad:=:gil-good-and-bad\"\n    }), \"\\n\", _jsxs(_components.p, {\n      children: [\"In \", _jsx(_components.strong, {\n        children: \"C\"\n      }), \", there is no inbuilt support for garbage collection. One has to manually de-allocate/free the memory. Unlike C, Python does garbage collection by using a mechanism called reference count. For every PyObject, Python keeps track of a count of how many references are pointing to the current object. If no reference is pointing to the current object, then, Python frees the memory by deleting the unused object.\"]\n    }), \"\\n\", _jsx(_components.p, {\n      children: \"Earlier we talked about GIL that, in the current process, GIL locks the process to have only a single thread to run the Python interpreter. This does not mean we cannot use more threads, but it is hard and takes more time compared to multi-threading in other languages because CPython creates a separate environment for each thread. This limits multi-threading in Python to use only in situations where threads wait for external processes to complete like I/O operations, network requests, etc.\"\n    }), \"\\n\", _jsx(_components.p, {\n      children: \"When multiple threads access the same resource, it is hard to keep track of the reference count of objects. GIL is required in CPython to ensure thread-safe as it allows only a single thread to process. As Python is a general-purpose language, in most cases there is no need to implement multi-threading, and there is no problem with GIL.\"\n    }), \"\\n\", _jsx(_components.p, {\n      children: \"But when there is a need to optimize CPU-intensive tasks, one must use multi-processing to utilize all cores and reduce the overall speed. We will talk about different use cases for multi-threading and multi-processing in the later part of this series.\"\n    }), \"\\n\", _jsx(_components.hr, {}), \"\\n\", _jsx(_components.p, {\n      children: \"Now, we have learned that there are a lot of things that contribute to the slowness of Python compared to other languages. We cannot change the design of Python but we can change how we write the code by using good libraries, code snippets, and changing implementations.\"\n    }), \"\\n\", _jsxs(_components.p, {\n      children: [\"In the upcoming posts, we discuss how we can use both internal and external libraries like \", _jsx(_components.em, {\n        children: \"multiprocessing\"\n      }), \", \", _jsx(_components.em, {\n        children: \"Cython\"\n      }), \", and \", _jsx(_components.em, {\n        children: \"Numba\"\n      }), \" to make Python blazingly faster.\"]\n    })]\n  });\n}\nfunction MDXContent(props = {}) {\n  const {wrapper: MDXLayout} = {\n    ..._provideComponents(),\n    ...props.components\n  };\n  return MDXLayout ? _jsx(MDXLayout, {\n    ...props,\n    children: _jsx(_createMdxContent, {\n      ...props\n    })\n  }) : _createMdxContent(props);\n}\nreturn {\n  default: MDXContent\n};\n","frontmatter":{},"scope":{}},"id":"super-fast-python-why-python-slow"},"__N_SSG":true}